file_name,file_path,duration,transcription,speaker_id,asr_result,wer,MOS_Quality,MOS_Naturalness,TER
VIVOSSPK25_166,./tiengviet/vivos_data/train/waves/VIVOSSPK25/VIVOSSPK25_166.wav,7.125,DO ĐÓ NHỮNG THÍ SINH Ở KHU VỰC HÀ TÂY CŨ NĂM NAY VẪN ĐƯỢC HƯỞNG ƯU TIÊN BÌNH THƯỜNG,VIVOSSPK25, Do đó những thí sinh ở khu vực Hà Tây cũ năm nay vẫn được hưởng ưu tiên bình thường,1.0,4.348381996154785,3.2285265922546387,0.0
VIVOSSPK27_124,./tiengviet/vivos_data/train/waves/VIVOSSPK27/VIVOSSPK27_124.wav,9.0,DO ĐÓ KHI NẠN NHÂN GẶP PHẢI NHỮNG TÌNH HUỐNG NHƯ THẾ CẦN BÁO NGAY VỚI CÔNG AN ĐỂ CÁC CƠ QUAN TIẾN HÀNH TỐ TỤNG VÀO CUỘC,VIVOSSPK27, Do đó khi nạn nhân gặp phải những tình huống như thế cần bảo ngay với công an để các cơ quan tiến hành tố tụng vào cuộc.,1.0,4.203410625457764,3.432514190673828,0.0357142857142857
VIVOSSPK29_144,./tiengviet/vivos_data/train/waves/VIVOSSPK29/VIVOSSPK29_144.wav,9.125,LÀN SÓNG ỦNG HỘ CÁC NẠN NHÂN CHẤT ĐỘC DA CAM TRÊN TUỔI TRẺ BẮT ĐẦU TỪ ĐÓ LÀN SÓNG ẤY LAN NHANH VÀ DÂNG CAO ĐẾN KHÔNG NGỜ,VIVOSSPK29, Làn sóng ủng hộ các nạn nhân chất độc da cam trên tuổi trẻ bắt đầu từ đó làn sóng ấy đang nhanh và dâng cao đến không ngờ.,1.0,4.420073509216309,3.1656277179718018,0.0
VIVOSSPK29_034,./tiengviet/vivos_data/train/waves/VIVOSSPK29/VIVOSSPK29_034.wav,10.46875,LUẬT SƯ CỦA ĐƯƠNG SỰ CÓ THỂ THƯƠNG LƯỢNG VỚI CÔNG TỐ VIÊN BẰNG CÁCH ĐỀ NGHỊ ĐƯA RA CÁC GIẢI PHÁP THIỆN CHÍ ĐỂ GIẢI QUYẾT VỤ VIỆC,VIVOSSPK29, Luật sư của đương sự có thể thương lượng với công tố viên bằng cách đề nghị đưa ra các giải pháp thiện chí để giải quyết vụ việc.,1.0,4.398622512817383,3.184065103530884,0.0
VIVOSSPK29_089,./tiengviet/vivos_data/train/waves/VIVOSSPK29/VIVOSSPK29_089.wav,10.625,CÁC ĐẠI BIỂU CŨNG ĐÃ NÊU VẤN ĐỀ HOẠT ĐỘNG CỦA CÁC TẬP ĐOÀN KINH TẾ NHÀ NƯỚC VỚI BỘ TRƯỞNG BỘ TÀI CHÍNH VŨ VĂN NINH,VIVOSSPK29, Các đại biểu cũng đã nêu vấn đề hoạt động của các tập đoàn kinh tế nhà nước với Bộ trưởng Bộ Tài chính Vũ Văn Ninh.,1.0,4.60699462890625,3.002550840377808,0.0
VIVOSSPK08_T018,./tiengviet/vivos_data/train/waves/VIVOSSPK08/VIVOSSPK08_T018.wav,3.0625,KHÔNG THẤY TÔI ĐANG TÌM ĐỐI SÁCH SAO,VIVOSSPK08, Không thấy tôi đang tìm đối sách sao?,1.0,4.130783081054688,3.416153907775879,0.0
VIVOSSPK12_T011,./tiengviet/vivos_data/train/waves/VIVOSSPK12/VIVOSSPK12_T011.wav,3.03125,THÚ VUI CỦA TA LÀ TRA TẤN TINH THẦN,VIVOSSPK12, Thú vui của ta là tra tấn tinh thần,1.0,3.6575403213500977,3.826915264129639,0.0
VIVOSSPK27_013,./tiengviet/vivos_data/train/waves/VIVOSSPK27/VIVOSSPK27_013.wav,9.625,ÔNG BẠN ẤY BẢO MÌNH DẠI VÌ NẾU MÌNH KHÔNG TRẢ CÁI NHÀ Ở KHU BIỆT THỰ TRUNG TỰ THÌ BÂY GIỜ ĐÃ CÓ HÀNG NGÀN CÂY VÀNG,VIVOSSPK27, Ông bạn ấy bảo mình dạy vì nếu mình không trả cái nhà ở khu biệt thự trung tự thì bây giờ đã có hàng ngàn cây vàng.,1.0,4.402853965759277,3.178410768508911,0.0
VIVOSSPK12_R083,./tiengviet/vivos_data/train/waves/VIVOSSPK12/VIVOSSPK12_R083.wav,3.3125,CHO GIỚI NGHỆ SĨ TRONG NGOÀI NƯỚC,VIVOSSPK12, Cho giới nghị sĩ trong ngoài nước,1.0,3.989649534225464,3.5373268127441406,0.0
VIVOSSPK12_R191,./tiengviet/vivos_data/train/waves/VIVOSSPK12/VIVOSSPK12_R191.wav,4.0,NÊN NGƯỜI CHƠI SẼ CHỈ THAM GIA CÁC SỰ KIỆN CHÍNH,VIVOSSPK12, Nên người chơi sẽ chỉ tham gia các sự kiện chính,1.0,4.161129474639893,3.3880984783172607,0.0
VIVOSSPK12_R181,./tiengviet/vivos_data/train/waves/VIVOSSPK12/VIVOSSPK12_R181.wav,3.8125,XIN MÃI MỚI SÓN RA ĐƯỢC MẤY HÀO,VIVOSSPK12, Xin mãi mới xón ra được mấy hào,1.0,4.133679389953613,3.4118804931640625,0.0
VIVOSSPK25_113,./tiengviet/vivos_data/train/waves/VIVOSSPK25/VIVOSSPK25_113.wav,7.625,NHỮNG KHU VỰC CÓ NGUỒN NƯỚC CHUNG CẦN KIỂM TRA VÀ CẮM BIỂN CẤM SỬ DỤNG NẾU NHIỄM KHUẨN,VIVOSSPK25, Những khu vực có nguồn nước chung cần kiểm tra và cấm biển cấm sử dụng nếu nhiễm khuẩn.,1.0,4.375043869018555,3.202000617980957,0.0
VIVOSSPK22_044,./tiengviet/vivos_data/train/waves/VIVOSSPK22/VIVOSSPK22_044.wav,3.25,VÀ DÂN DÃ NHƯ CHÍNH CÁI TÊN CỦA NÓ,VIVOSSPK22, và danh giả như chính cái tên của nó.,1.0,3.9731478691101074,3.794800996780396,0.1111111111111111
VIVOSSPK36_178,./tiengviet/vivos_data/train/waves/VIVOSSPK36/VIVOSSPK36_178.wav,7.875,ĐIỀU NÀY GIÚP CHỒNG BẠN GIÁN TIẾP KHOE VỚI BẠN MÌNH Ở NHÀ VỢ TỚ CŨNG ĐẸP VÀ KHÔNG LÔI THÔI CẦU KỲ ĐÂU NHÉ,VIVOSSPK36, Điều này giúp chồng bạn gián tiếp khoe với bạn Mình ở nhà vợ tớ xinh đẹp và không lôi thôi cầu kỳ đâu nhé,1.0,4.211352348327637,3.4318835735321045,0.04
VIVOSSPK07_T016,./tiengviet/vivos_data/train/waves/VIVOSSPK07/VIVOSSPK07_T016.wav,4.3125,GIƠ HAI TAY LÊN KHÔNG TÔI BẮN,VIVOSSPK07, Giờ hai tay lên không tôi bắn,1.0,3.941545248031616,3.578198909759521,0.0
VIVOSSPK27_210,./tiengviet/vivos_data/train/waves/VIVOSSPK27/VIVOSSPK27_210.wav,8.125,TUY NHIÊN BIỆN PHÁP NÀY VẪN ĐƯỢC COI LÀ CÒN KHÁ NHẸ VÌ KHÔNG THỂ GIẢI QUYẾT RỐT RÁO VẤN ĐỀ,VIVOSSPK27," Tuy nhiên, biện pháp này vẫn được coi là khá nhẹ vì không thể giải quyết rốt ráo vấn đề.",1.0,4.318902015686035,3.3540313243865967,0.0476190476190476
VIVOSSPK15_104,./tiengviet/vivos_data/train/waves/VIVOSSPK15/VIVOSSPK15_104.wav,2.09375,GIẢI PHÁP TRÊN,VIVOSSPK15, Giải pháp trên,1.0,3.6937005519866943,3.792983531951904,0.0
VIVOSSPK15_098,./tiengviet/vivos_data/train/waves/VIVOSSPK15/VIVOSSPK15_098.wav,3.6875,THANH NIÊN NẢY SINH TÂM LÝ Ỷ LẠI,VIVOSSPK15, Thanh niên nảy sinh tâm lý ỉ lại,1.0,3.9764962196350098,3.5471608638763428,0.0
VIVOSSPK27_117,./tiengviet/vivos_data/train/waves/VIVOSSPK27/VIVOSSPK27_117.wav,7.25,VÀ NHỮNG CHỈ TIÊU NÀY CŨNG HỦY DIỆT GẦN NHƯ HOÀN TOÀN MỌI SÁNG TẠO NĂNG ĐỘNG CỦA DOANH NGHIỆP,VIVOSSPK27, Và những trí tiêu này cũng hủy diệt gần như hoàn toàn mọi sáng tạo năng động của doanh nghiệp.,1.0,4.425631523132324,3.2658138275146484,0.05
VIVOSSPK46_108,./tiengviet/vivos_data/train/waves/VIVOSSPK46/VIVOSSPK46_108.wav,4.374375,NÓ KHÔNG HỀ NGỜ TRÊN ĐƯỜNG VỀ HANG CÓ NGƯỜI BÁM THEO SAU,VIVOSSPK46, Nó không hề ngờ trên đường về hang có người bám theo sau.,1.0,3.885646104812622,3.6253528594970703,0.0
VIVOSSPK22_026,./tiengviet/vivos_data/train/waves/VIVOSSPK22/VIVOSSPK22_026.wav,3.40625,TÔI ĐÃ PHẢI TẬP LUYỆN CẬN LỰC,VIVOSSPK22, Tôi đã phải tập luyện cạnh lực.,1.0,4.327240467071533,3.241496324539185,0.0
VIVOSSPK22_245,./tiengviet/vivos_data/train/waves/VIVOSSPK22/VIVOSSPK22_245.wav,4.03125,CHÍN MƯƠI SÁU CHÍN MƯƠI BẢY,VIVOSSPK22," Chính mươi sáu, chính mươi bảy.",1.0,3.756911516189575,3.7368359565734863,0.0
VIVOSSPK09_R117,./tiengviet/vivos_data/train/waves/VIVOSSPK09/VIVOSSPK09_R117.wav,3.375,TRƯỚC ĐÀN CÓ ĐÀO HỒ VUÔNG LÀM MINH ĐƯỜNG,VIVOSSPK09, Trước đàn có đào hồ vuông làm minh đường,1.0,4.150204658508301,3.394844055175781,0.0
VIVOSSPK27_212,./tiengviet/vivos_data/train/waves/VIVOSSPK27/VIVOSSPK27_212.wav,7.25,NHẬT BẢN ỦY BAN CHÍNH PHỦ NHẤT TRÍ KIẾN NGHỊ CÔNG CHÚA CÓ THỂ KẾ VỊ NGAI VÀNG,VIVOSSPK27, Nhật Bản ủy ban chính phủ nhất trí kiến nghị công chúa có thể kế vị ngay vàng.,1.0,4.118122100830078,3.4222733974456787,0.0
VIVOSSPK22_105,./tiengviet/vivos_data/train/waves/VIVOSSPK22/VIVOSSPK22_105.wav,2.625,NHỮNG VIÊN GẠCH ĐỀU HAI MÁU,VIVOSSPK22, Những viên gạch đều 2 máu.,1.0,3.9895565509796143,3.897983551025391,0.1666666666666666
VIVOSSPK09_R067,./tiengviet/vivos_data/train/waves/VIVOSSPK09/VIVOSSPK09_R067.wav,3.5625,VÀ LẠI BẮT NÓ PHẢI HY SINH NHIỀU ĐẾN THẾ,VIVOSSPK09, Và lại bắt nó phải hy sinh nhiều đến thế.,1.0,4.219141960144043,3.332691669464112,0.0
VIVOSSPK22_154,./tiengviet/vivos_data/train/waves/VIVOSSPK22/VIVOSSPK22_154.wav,4.6875,BẰNG CÁCH MUA LẠI TẤT CẢ CÁC LƯỢNG NÔNG PHẨM BỊ Ứ ĐỌNG,VIVOSSPK22, bằng cách mua lại tất cả các lường nông phẩm bị ưu động.,1.0,4.131906032562256,3.5769243240356445,0.0769230769230769
VIVOSSPK25_122,./tiengviet/vivos_data/train/waves/VIVOSSPK25/VIVOSSPK25_122.wav,6.65625,NGÀY ẤY NGOÀI CON ĐƯỜNG ĐẤT ĐỎ DẪN ĐẾN TRƯỜNG CÒN PHẢI VƯỢT DỐC LEO ĐÈO RẤT VẤT VẢ,VIVOSSPK25, Ngày nay ngoài con đường đất đỏ dẫn đến trường còn phải vượt dốc leo đèo rất bất vả.,1.0,4.399421215057373,3.2904186248779297,0.0526315789473684
VIVOSSPK29_194,./tiengviet/vivos_data/train/waves/VIVOSSPK29/VIVOSSPK29_194.wav,6.53125,TRƯỜNG BÓNG ĐÁ SẼ LÀ NƠI SINH HOẠT DÀNH CHO TRẺ EM YÊU THÍCH BÓNG ĐÁ CÓ NĂNG KHIẾU,VIVOSSPK29, Trường bóng đá sẽ là nơi sinh hoạt dành cho trẻ em yêu thích bóng đá có năng khiếu.,1.0,4.244930744171143,3.3093409538269043,0.0
VIVOSSPK29_062,./tiengviet/vivos_data/train/waves/VIVOSSPK29/VIVOSSPK29_062.wav,6.0,SÂN CĂN NHÀ CỤ VƯƠNG BỊ CHIẾM DỤNG DỰNG LỀU CHỨA HÀNG HÓA VÀ VẬT DỤNG SINH HOẠT,VIVOSSPK29, Sân căn nhà cụ vương bị chiếm dụng dựng liều chứa hàng hóa và vật dụng sinh hoạt.,1.0,4.257347106933594,3.420016288757324,0.0555555555555555
VIVOSSPK08_R013,./tiengviet/vivos_data/train/waves/VIVOSSPK08/VIVOSSPK08_R013.wav,2.0625,TÊN CÔ GÁI,VIVOSSPK08, Tên cô gái,1.0,3.806755781173706,3.6891489028930655,0.0
VIVOSSPK15_273,./tiengviet/vivos_data/train/waves/VIVOSSPK15/VIVOSSPK15_273.wav,3.03125,VỨT BỎ ĐỒ ĐAO LẬP ĐIA THÀNH PHẬT,VIVOSSPK15," Vứt bỏ đồ đao, lập địa thành Phật.",1.0,4.003350257873535,3.7917652130126953,0.125
VIVOSSPK08_R101,./tiengviet/vivos_data/train/waves/VIVOSSPK08/VIVOSSPK08_R101.wav,3.3125,MỘT BÊN CÒN CÓ CHIẾC CỌN NƯỚC RÊU PHONG,VIVOSSPK08, Một bên còn có chiếc cọn nước rêu phong.,1.0,3.963230848312378,3.552642822265625,0.0
VIVOSSPK29_017,./tiengviet/vivos_data/train/waves/VIVOSSPK29/VIVOSSPK29_017.wav,5.375,CỌ ĐÁNH MÁ HỒNG NHỎ HƠN CỌ PHỦ PHẤN ĐẦU TRÒN LÔNG NHỎ VÀ MỊN,VIVOSSPK29, Cỏ đánh má hồng nhỏ hơn cỏ phủ phấn đầu tròn lông nhỏ và mịn.,1.0,4.590288162231445,3.2993874549865723,0.1333333333333333
VIVOSSPK08_R128,./tiengviet/vivos_data/train/waves/VIVOSSPK08/VIVOSSPK08_R128.wav,3.34375,EM BỊ NGƯA NGỨA HAY MÌNH ĐI KHÁM,VIVOSSPK08, Em bị ngưa ngứa hay mình đi khám?,1.0,3.965620994567871,3.549950361251831,0.0
VIVOSSPK17_121,./tiengviet/vivos_data/train/waves/VIVOSSPK17/VIVOSSPK17_121.wav,1.6875,ĐƯA ĐẾN TÌNH TRẠNG,VIVOSSPK17, đưa đến tình trạng,1.0,4.036402702331543,3.486723661422729,0.0
VIVOSSPK29_007,./tiengviet/vivos_data/train/waves/VIVOSSPK29/VIVOSSPK29_007.wav,9.65625,CÁI KHÔNG KHÍ NHỊP SỐNG CỰC KỲ NHỘN NHỊP VÀ SÔI ĐỘNG THƯỜNG NGÀY CỦA SÀI GÒN KHIẾN NGƯỜI NƠI ĐÂY CÓ CẢM GIÁC THÂN THIẾT KHÓ RỜI,VIVOSSPK29, Cái không khí nhịp sóng cực kỳ nhộn nhịp và sôi động thường ngày của Sài Gòn khiến người ở nơi đây có cảm giác thân thiết khó rờ.,1.0357142857142858,4.701813697814941,3.182116985321045,0.0357142857142857
VIVOSSPK08_R063,./tiengviet/vivos_data/train/waves/VIVOSSPK08/VIVOSSPK08_R063.wav,2.3125,TRƯỚC KHI RA KHỎI NHÀ,VIVOSSPK08," Trước khi ra khỏi nhà,",1.0,3.895861864089966,3.608651161193848,0.0
VIVOSSPK15_195,./tiengviet/vivos_data/train/waves/VIVOSSPK15/VIVOSSPK15_195.wav,4.125,ĐÓ CÓ THỂ LÀ THỬ CHƠI MỘT MÔN THỂ THAO MỚI,VIVOSSPK15, Đó có thể là thử chơi một môn thể thao mới.,1.0,3.975604772567749,3.539325714111328,0.0
VIVOSSPK08_R078,./tiengviet/vivos_data/train/waves/VIVOSSPK08/VIVOSSPK08_R078.wav,3.25,CÓ THỂ KHIẾN NGƯỜI BỊ SA THẢI CẢM THẤY NGỘT NGẠT,VIVOSSPK08, có thể khiến người bị sa thải cảm thấy ngột ngạt.,1.0,3.937493562698364,3.572029829025269,0.0
VIVOSSPK15_113,./tiengviet/vivos_data/train/waves/VIVOSSPK15/VIVOSSPK15_113.wav,3.71875,PHẦN NÀO KHIẾN GIẢI THƯỞNG NGÀNH MÚA KHÁ XÔM TỤ,VIVOSSPK15, phần nào khiến giải thưởng ngành múa khá sơm tụ.,1.0,3.51533579826355,3.938482999801636,0.0
VIVOSSPK25_062,./tiengviet/vivos_data/train/waves/VIVOSSPK25/VIVOSSPK25_062.wav,7.75,PHẢI CHI CHUYỆN BỰC MÌNH HAY KHÓ CHỊU NÀO CŨNG CÓ THỂ DỄ DÀNG LOẠI BỎ ĐƯỢC NHƯ VẬY THÌ TỐT BIẾT MẤY,VIVOSSPK25, Phải chi chuyện bực mình hay khó chịu nào cũng có thể dễ dàng loại bỏ được như vậy thì tốt biết mấy.,1.0,4.464015007019043,3.113598108291626,0.0
VIVOSSPK08_R127,./tiengviet/vivos_data/train/waves/VIVOSSPK08/VIVOSSPK08_R127.wav,3.9375,MÀ KHÔNG CẦN QUỐC HỘI CHUẨN THUẬN VỀ MẶT NHÂN SỰ,VIVOSSPK08, mà không cần Quốc hội chuẩn thuận về mặt nhân sự.,1.0,4.247241973876953,3.301607608795166,0.0
VIVOSSPK09_R029,./tiengviet/vivos_data/train/waves/VIVOSSPK09/VIVOSSPK09_R029.wav,2.96875,ĐÃ LÀM GIÁ TIÊU DÙNG TĂNG LÊN,VIVOSSPK09, Đã làm giá tiêu dùng tăng lên,1.0,4.087930202484131,3.440058946609497,0.0
VIVOSSPK12_R130,./tiengviet/vivos_data/train/waves/VIVOSSPK12/VIVOSSPK12_R130.wav,2.625,ÔNG KHÔNG NÉN ĐƯỢC NỖI BỰC DỌC,VIVOSSPK12, Ông không nén được nỗi bực dọc,1.0,3.979042053222656,3.533451557159424,0.0
VIVOSSPK46_214,./tiengviet/vivos_data/train/waves/VIVOSSPK46/VIVOSSPK46_214.wav,4.968125,BÊN DÒNG SÔNG CHẢY TỪ BAN TRƯA SANG BUỔI CHIỀU NGÂN ĐẦY TRĂM LẺ TÁM,VIVOSSPK46," Bên dòng sông chảy từ ban trưa sang buổi chiều, ngân đầy giông lẻ tám.",1.0,3.670727252960205,3.801363706588745,0.0
VIVOSSPK27_029,./tiengviet/vivos_data/train/waves/VIVOSSPK27/VIVOSSPK27_029.wav,7.4375,CÒN NGAY BÂY GIỜ HÃY TRÒ CHUYỆN VỚI NGƯỜI THÂN HAY ĐƠN GIẢN HƠN NÓI MỘT LỜI YÊU THƯƠNG,VIVOSSPK27, Còn ngay bây giờ hãy trò chuyện với người thân hay đơn giản hơn nói một lời yêu thương,1.0,4.486885070800781,3.0912790298461914,0.0
VIVOSSPK20_167,./tiengviet/vivos_data/train/waves/VIVOSSPK20/VIVOSSPK20_167.wav,3.1875,MÀ NGƯỜI ĐẦU CƠ CÓ THỂ LỢI DỤNG ĐỂ HƯỞNG LỢI TRÁI ĐẠO LÝ,VIVOSSPK20, mà người đầu cơ có thể lợi dụng để hưởng lợi trái đạo lý.,1.0,4.437699317932129,3.133077621459961,0.0
VIVOSSPK27_241,./tiengviet/vivos_data/train/waves/VIVOSSPK27/VIVOSSPK27_241.wav,6.375,BÂY GIỜ ĐÃ ĐẾN LÚC ĐỂ BẠN TRỔ TÀI CẮM HOA THEO Ý THÍCH VÀ SỞ TRƯỜNG CỦA MÌNH RỒI ĐẤY,VIVOSSPK27, Bây giờ đã đến lúc bạn chỗ tài cắm hoa theo ý thích và sở trường của mình rồi đấy.,1.0,4.288372039794922,3.470890998840332,0.0952380952380952
VIVOSSPK09_R088,./tiengviet/vivos_data/train/waves/VIVOSSPK09/VIVOSSPK09_R088.wav,2.46875,MỘT TÁC GIẢ CHUYÊN NGHIỆP,VIVOSSPK09, Một tác giả chuyên nghiệp,1.0,4.270538330078125,3.276888847351074,0.0
VIVOSSPK12_R057,./tiengviet/vivos_data/train/waves/VIVOSSPK12/VIVOSSPK12_R057.wav,4.21875,LẠI CÀNG LÀM CHO MIỀN ĐẤT HỨA BÍ ẨN,VIVOSSPK12, Lại càng làm cho miền đất hứa bí ẩn,1.0,4.019821166992188,3.494458675384521,0.0
VIVOSSPK03_R194,./tiengviet/vivos_data/train/waves/VIVOSSPK03/VIVOSSPK03_R194.wav,3.1875,SẼ NHẬN RA NHỮNG DẤU HIỆU BÁO TRƯỚC TRÊN ĐƯỜNG,VIVOSSPK03, sẽ nhận ra những dấu hiệu báo trước trên đường.,1.0,4.063042640686035,3.456880569458008,0.0
VIVOSSPK25_024,./tiengviet/vivos_data/train/waves/VIVOSSPK25/VIVOSSPK25_024.wav,5.75,CUỐI CÙNG ANH CŨNG ĐÃ NHẬN RA RẰNG ANH CŨNG CÓ QUYỀN ĐƯỢC YÊU THƯƠNG,VIVOSSPK25, Cuối cùng anh cũng đã nhận ra rằng anh cũng có quyền được yêu thương,1.0,4.754179954528809,2.8559882640838623,0.0
VIVOSSPK20_233,./tiengviet/vivos_data/train/waves/VIVOSSPK20/VIVOSSPK20_233.wav,1.875,BẢY MƯƠI HAI BẢY MƯƠI BA,VIVOSSPK20," Bảy mươi hai, bảy mươi ba.",1.0,3.978254795074463,3.5286731719970703,0.0
VIVOSSPK15_020,./tiengviet/vivos_data/train/waves/VIVOSSPK15/VIVOSSPK15_020.wav,5.71875,ĐÂY LÀ MÓN ĂN GIA ĐÌNH CỦA NHÀ BÀ LAO CÔNG SỚT QUA,VIVOSSPK15, Đây là món ăn gia đình của nhà bà Lao Công Sớt Hoa.,1.0,4.062727928161621,3.455071926116944,0.0
VIVOSSPK08_R137,./tiengviet/vivos_data/train/waves/VIVOSSPK08/VIVOSSPK08_R137.wav,4.1875,VÀ MIẾNG CƠM CHƯA VỮNG VĂNG TUNG TÓE ĐẦY SÀN,VIVOSSPK08, Và miếng cơm chưa vẫn văng tung tué đầy sàng.,1.0,4.008424758911133,3.7212703227996826,0.1
VIVOSSPK29_128,./tiengviet/vivos_data/train/waves/VIVOSSPK29/VIVOSSPK29_128.wav,8.0625,CÁC BẠN BIẾT RẰNG TẤT CẢ MỌI NGƯỜI CÙNG HOẠT ĐỘNG NHỊP NHÀNG THÌ DÂY CHUYỀN MỚI TIẾP TỤC ĐƯỢC,VIVOSSPK29, Các bạn biết rằng tất cả mọi người cùng hoạt động nhịp nhàng thì dây chuyền mới tiếp tục được.,1.0,4.265308380126953,3.278491973876953,0.0
VIVOSSPK08_T047,./tiengviet/vivos_data/train/waves/VIVOSSPK08/VIVOSSPK08_T047.wav,3.4375,NGÀY MAI NHỚ QUAY LẠI LẤY TIỀN THỐI NHA,VIVOSSPK08, Ngày mai nhớ quay lại lấy tiền thói nha,1.0,3.9374923706054688,3.562265396118164,0.0
VIVOSSPK07_R123,./tiengviet/vivos_data/train/waves/VIVOSSPK07/VIVOSSPK07_R123.wav,4.3125,TRÊN GƯƠNG MẶT ANH ĐẦU BẾP NGƯỜI PHÁP GỐC VIỆT NÀY,VIVOSSPK07, Trên gương mặt anh đầu bếp người Pháp gốc Việt này,1.0,4.003705978393555,3.5040054321289062,0.0
VIVOSSPK22_145,./tiengviet/vivos_data/train/waves/VIVOSSPK22/VIVOSSPK22_145.wav,3.09375,MỘT ĐIỂM ĐẶC BIỆT NỮA LÀ,VIVOSSPK22, Một điểm đặc biệt nữa là...,1.0,3.951364755630493,3.5490972995758057,0.0
VIVOSSPK46_067,./tiengviet/vivos_data/train/waves/VIVOSSPK46/VIVOSSPK46_067.wav,3.468125,MỘT LÀ DO CÁC HỘI NGHỆ THUẬT CHUYÊN NGÀNH GIỚI THIỆU,VIVOSSPK46, Một là do các hội nghệ thuật chuyên ngành giới thiệu,1.0,3.8611674308776855,3.627435207366944,0.0
VIVOSSPK08_T046,./tiengviet/vivos_data/train/waves/VIVOSSPK08/VIVOSSPK08_T046.wav,2.46875,DỰ ÁN CHỪNG NÀO XONG VẬY,VIVOSSPK08, Dự án chừng nào xong vậy?,1.0,3.812710762023926,3.669085502624512,0.0
VIVOSSPK46_029,./tiengviet/vivos_data/train/waves/VIVOSSPK46/VIVOSSPK46_029.wav,5.343125,NHIỀU LẦN HỌ LẬP BIÊN BẢN VI PHẠM VÀ KIẾN NGHỊ XỬ LÝ NGHIÊM,VIVOSSPK46, Nhiều lần họ lập biên bản vi phạm và kiến nghị xử lý nghiêm.,1.0,4.042170524597168,3.469610452651977,0.0
VIVOSSPK07_R043,./tiengviet/vivos_data/train/waves/VIVOSSPK07/VIVOSSPK07_R043.wav,4.03125,NÀNG NHÌN ÔNG TA CHÒNG CHỌC MẤT MỘT LÚC,VIVOSSPK07, Nàng nhìn ông ta trồng trọc mất một lúc,1.0,4.088998794555664,3.428593397140503,0.0
VIVOSSPK08_R040,./tiengviet/vivos_data/train/waves/VIVOSSPK08/VIVOSSPK08_R040.wav,3.1875,VÀ MỘT LÁ THƯ MỚI NHẤT CỦA EM TRÍ,VIVOSSPK08, Và một lá thư mới nhất của em Trí.,1.0,3.924445390701294,3.5710997581481934,0.0
VIVOSSPK12_R188,./tiengviet/vivos_data/train/waves/VIVOSSPK12/VIVOSSPK12_R188.wav,3.1875,VIỆC LÀM ĐÓ BỊ NHIỀU NGƯỜI CỰ NỰ,VIVOSSPK12, Việc làm đó bị nhiều người cử nữ.,1.0,4.417018890380859,3.690608263015747,0.25
VIVOSSPK09_R087,./tiengviet/vivos_data/train/waves/VIVOSSPK09/VIVOSSPK09_R087.wav,3.25,ĐỂ BÁN BÁNH XÈO VÀ BÚN RIÊU NUÔI GIA ĐÌNH,VIVOSSPK09, Để bán bánh xèo và bún riêu nuôi gia đình,1.0,4.0907182693481445,3.425955057144165,0.0
VIVOSSPK27_003,./tiengviet/vivos_data/train/waves/VIVOSSPK27/VIVOSSPK27_003.wav,9.8125,NGƯỜI CHA GIÀU THƯỜNG LẤY MÔN GÔN LÀM ẨN DỤ ĐỂ GIẢI THÍCH CHO TRIẾT LÝ CỦA ÔNG TA VỀ TIỀN BẠC,VIVOSSPK27, Người cha giàu thường lấy môn gôn làm ẩn dụ để giải thích cho chiếc lý của ông ta về tiền bạc.,1.0,4.227774143218994,3.3041248321533203,0.0
VIVOSSPK08_T014,./tiengviet/vivos_data/train/waves/VIVOSSPK08/VIVOSSPK08_T014.wav,3.15625,TRÒ CHƠI MỚI RA HAY QUÁ NHỈ,VIVOSSPK08, Trò chơi mới ra hay quá nhỉ!,1.0,3.7697930335998535,3.7021963596344,0.0
VIVOSSPK27_036,./tiengviet/vivos_data/train/waves/VIVOSSPK27/VIVOSSPK27_036.wav,7.5625,ANH ẤY THẬM CHÍ CÒN KHÔNG ĐƯỢC CHƠI THƯỜNG XUYÊN CHO ĐỘI TUYỂN ANH KHÔNG ĐƯỢC CHO CÁC ĐỘI BÓNG HAY NHẤT,VIVOSSPK27," Anh ấy thậm chí còn không được chơi thường xuyên cho đội tuyển Anh, không được cho các đội bóng hay nhất.",1.0,4.17147159576416,3.3530373573303223,0.0
VIVOSSPK17_060,./tiengviet/vivos_data/train/waves/VIVOSSPK17/VIVOSSPK17_060.wav,2.25,TIỆM MỘC CỦA ANH THANH GẦN ĐÓ,VIVOSSPK17, Tệ mọc của anh Thanh gần đó,1.0,4.6852617263793945,3.219088792800904,0.1428571428571428
VIVOSSPK07_R082,./tiengviet/vivos_data/train/waves/VIVOSSPK07/VIVOSSPK07_R082.wav,4.09375,TUY NHIÊN MỰC NƯỚC CHƯA CAO,VIVOSSPK07, Tuy nhiên mực nước chưa cao,1.0,3.691239833831787,3.769876956939697,0.0
VIVOSSPK08_R019,./tiengviet/vivos_data/train/waves/VIVOSSPK08/VIVOSSPK08_R019.wav,2.125,BUỔI SÁNG HÔM ẤY,VIVOSSPK08, Buổi sáng hôm ấy,1.0,3.982974052429199,3.5157623291015625,0.0
VIVOSSPK12_R061,./tiengviet/vivos_data/train/waves/VIVOSSPK12/VIVOSSPK12_R061.wav,2.875,MỘT TRONG NHỮNG YẾU TỐ CỐT LÕI,VIVOSSPK12, một trong những yếu tố cốt lõi.,1.0,4.071789264678955,3.4382922649383545,0.0
VIVOSSPK36_032,./tiengviet/vivos_data/train/waves/VIVOSSPK36/VIVOSSPK36_032.wav,5.375,SAU THỜI ĐIỂM NÀY THÍ SINH CÓ THỂ TRỰC TIẾP NỘP HỒ SƠ DỰ THI TẠI PHÒNG ĐÀO TẠO TRƯỜNG MÌNH DỰ TUYỂN,VIVOSSPK36," Sau thời điểm này, thí sinh có thể trực tiếp nộp hồ sơ dự thi tại phòng đào tạo trường mình dự tuyển.",1.0,4.393679141998291,3.157939910888672,0.0
VIVOSSPK25_012,./tiengviet/vivos_data/train/waves/VIVOSSPK25/VIVOSSPK25_012.wav,7.25,ĐÓ LÀ MỘT TRONG NHỮNG LÝ DO KHIẾN CÁC TRIỂN LÃM ĐƯƠNG ĐẠI ĐA PHƯƠNG TIỆN XUẤT HIỆN NGÀY MỘT NHIỀU,VIVOSSPK25, Đó là một trong những lý do khiến các triển lãm đương đại đa phương tiện xuất hiện ngày một nhiều.,1.0,4.606154441833496,2.973195552825928,0.0
VIVOSSPK17_110,./tiengviet/vivos_data/train/waves/VIVOSSPK17/VIVOSSPK17_110.wav,1.875,BÀ CÒN NÓI THÊM RẰNG,VIVOSSPK17, Bà còn nói thêm rằng,1.0,4.092656135559082,3.4194869995117188,0.0
VIVOSSPK36_166,./tiengviet/vivos_data/train/waves/VIVOSSPK36/VIVOSSPK36_166.wav,4.5625,CUNG ĐÃ ĐỦ CẦU NHƯNG DƯỜNG NHƯ CẦU ĐÃ BẮT ĐẦU XUẤT HIỆN DẤU HIỆU ẢO,VIVOSSPK36, Cung đã đủ cầu nhưng dường như cầu đã bắt đầu xuất hiện dấu hiệu ảo.,1.0,4.554133892059326,3.0183751583099365,0.0
VIVOSSPK08_R197,./tiengviet/vivos_data/train/waves/VIVOSSPK08/VIVOSSPK08_R197.wav,5.1875,HOẶC NƯỚC MÍA ĐỂ CHẾ CÁC LOẠI NƯỚC GIẢI KHÁT THANH NHIỆT TRONG MÙA HÈ,VIVOSSPK08, hoặc nước mía để chế các loại nước giải khát thanh nhiệt trong mùa hè.,1.0,4.034747123718262,3.4698193073272705,0.0
VIVOSSPK12_R016,./tiengviet/vivos_data/train/waves/VIVOSSPK12/VIVOSSPK12_R016.wav,4.125,TRÊN NHỮNG TRIỀN ĐỒI ĐÁ GAN TRÂU BẠC MẦU NÀY,VIVOSSPK12, Trên những truyền đồi đá gan trâu bạc mộng này,1.0,4.240250110626221,3.5103158950805664,0.1
VIVOSSPK12_R026,./tiengviet/vivos_data/train/waves/VIVOSSPK12/VIVOSSPK12_R026.wav,4.0,QUA DÁNG AI MÀ TRẮNG ĐẾN TRONG SUỐT,VIVOSSPK12, Qua dáng ai mà trắng đến trong suốt,1.0,4.064034461975098,3.4442896842956543,0.0
VIVOSSPK09_R019,./tiengviet/vivos_data/train/waves/VIVOSSPK09/VIVOSSPK09_R019.wav,3.53125,TÔI LIỀN BỎ VẼ TRONG MỘT THỜI GIAN,VIVOSSPK09, Tôi liền bỏ vẽ trong một thời gian,1.0,4.28210973739624,3.253845453262329,0.0
VIVOSSPK15_300,./tiengviet/vivos_data/train/waves/VIVOSSPK15/VIVOSSPK15_300.wav,2.5,MẤY QUÁN LẨU DÊ ĐÔNG NHƯ KIẾN,VIVOSSPK15, Mấy quán lẩu dê đông như kiến,1.0,4.025208473205566,3.476776123046875,0.0
VIVOSSPK22_153,./tiengviet/vivos_data/train/waves/VIVOSSPK22/VIVOSSPK22_153.wav,4.875,SẼ GÂY THIỆT THÒI CHO CÁC DOANH NGHIỆP ĐÃ ĐẨY MẠNH XUẤT KHẨU,VIVOSSPK22, sẽ gây thiệt thòi cho các doanh nghiệp đã đẩy mình xích khẩu.,1.0,4.173141479492188,3.685274124145508,0.1538461538461538
VIVOSSPK15_036,./tiengviet/vivos_data/train/waves/VIVOSSPK15/VIVOSSPK15_036.wav,3.0625,ĐÃ ĐƯỢC BẠN ĐỌC GỬI TỚI,VIVOSSPK15, Đã được bạn đọc gửi tới.,1.0,3.9910733699798575,3.5061194896698,0.0
VIVOSSPK08_R154,./tiengviet/vivos_data/train/waves/VIVOSSPK08/VIVOSSPK08_R154.wav,3.84375,KÈM THEO NHỮNG VỊ LÀ LẠ CỦA MẮC KHÉN,VIVOSSPK08, kèm theo những vị là lạ của mắt khén.,1.0,4.072214603424072,3.434720277786255,0.0
VIVOSSPK17_092,./tiengviet/vivos_data/train/waves/VIVOSSPK17/VIVOSSPK17_092.wav,2.625,TỪNG CÁI RIẾT VÀO DA MẠNH MẼ,VIVOSSPK17, Từng cái rếp vào da mạnh mẽ,1.0,4.218094825744629,3.620882749557495,0.1428571428571428
VIVOSSPK18_132,./tiengviet/vivos_data/train/waves/VIVOSSPK18/VIVOSSPK18_132.wav,2.4375,BẰNG CÁCH CHƯỜM NƯỚC NÓNG LÊN BỤNG VÀ THẮT LƯNG,VIVOSSPK18, Bằng cách chườm nước nóng lên bụng và thắt lưng,1.0,4.406878471374512,3.14359450340271,0.0
