file_name,file_path,duration,transcription,speaker_id,asr_result,wer,MOS_Quality,MOS_Naturalness,TER
VIVOSSPK18_027,./tiengviet/vivos_data/train/waves/VIVOSSPK18/VIVOSSPK18_027.wav,2.1875,CHUYỆN DẠY VÀ HỌC CHỮ NƠI ĐÂY ĐÃ KHÓ RỒI,VIVOSSPK18, Chuyện dạy và học chữ nơi đây đã khó rồi,1.0,4.744875431060791,3.174782514572144,0.0
VIVOSSPK20_283,./tiengviet/vivos_data/train/waves/VIVOSSPK20/VIVOSSPK20_283.wav,2.5625,LẬP TRÌNH VIÊN ĐA SỐ ĐỀU BỊ TÂM THẦN,VIVOSSPK20, Lập trình viên đa số đều bị tâm thần.,1.0,4.058725357055664,3.770219802856445,0.0
VIVOSSPK18_150,./tiengviet/vivos_data/train/waves/VIVOSSPK18/VIVOSSPK18_150.wav,2.125,RỚT CHẢY LÒNG THÒNG,VIVOSSPK18, Rớt chảy lòng thòng.,1.0,4.239056587219238,3.613291740417481,0.0
VIVOSSPK22_106,./tiengviet/vivos_data/train/waves/VIVOSSPK22/VIVOSSPK22_106.wav,2.875,HAY DỐC HẾT HY VỌNG VÀO TƯƠNG LAI,VIVOSSPK22, Hay dốc hết hy vọng vào tương lai?,1.0,4.017755508422852,3.805294990539551,0.0
VIVOSSPK08_R017,./tiengviet/vivos_data/train/waves/VIVOSSPK08/VIVOSSPK08_R017.wav,2.90625,ĐƯỢC SỬ DỤNG XÂY DỰNG TRANG TRẠI,VIVOSSPK08, Được sử dụng xây dựng trang trại.,1.0,4.134731292724609,3.702881574630737,0.0
VIVOSSPK29_121,./tiengviet/vivos_data/train/waves/VIVOSSPK29/VIVOSSPK29_121.wav,5.9375,NÓ CÒN TÁC ĐỘNG LÊN TRUNG ƯƠNG THẦN KINH VÙNG CẢM NHẬN THÈM ĂN KÍCH THÍCH THÈM ĂN,VIVOSSPK29, Nó còn tác động lên trung ương thần kinh vùng cảm nhận thèm ăn kích thích thèm ăn,1.0,4.428000450134277,3.447361469268799,0.0
VIVOSSPK08_R010,./tiengviet/vivos_data/train/waves/VIVOSSPK08/VIVOSSPK08_R010.wav,3.25,NGUỒI ĐỂ NƯỚC NGUỒI NGUỘI RỒI HÃY UỐNG,VIVOSSPK08, Nguồi để nước nguồi nguội rồi hãy uống,1.0,4.212035655975342,3.6349010467529297,0.0
VIVOSSPK15_191,./tiengviet/vivos_data/train/waves/VIVOSSPK15/VIVOSSPK15_191.wav,4.125,HIỆN ĐANG ĐƯỢC TẬP TRUNG KHÔI PHỤC THEO TỪNG BƯỚC,VIVOSSPK15, Hiện đang được tập trung khôi phục theo từng bước.,1.0,4.372420787811279,3.4952733516693115,0.0
VIVOSSPK12_R046,./tiengviet/vivos_data/train/waves/VIVOSSPK12/VIVOSSPK12_R046.wav,3.34375,GIỮA SỚI CHỌI MỘT CHIẾC BÀN ĐỦ RỘNG,VIVOSSPK12, Giữa xới chọi một chiếc bàn đủ rộng.,1.0,4.139848709106445,3.6973659992218018,0.0
VIVOSSPK15_080,./tiengviet/vivos_data/train/waves/VIVOSSPK15/VIVOSSPK15_080.wav,2.78125,TRONG THỜI BUỔI NHÁ NHEM,VIVOSSPK15, Trong thời buổi nhá nhem,1.0,4.066285133361816,3.7604238986968994,0.0
VIVOSSPK17_264,./tiengviet/vivos_data/train/waves/VIVOSSPK17/VIVOSSPK17_264.wav,2.34375,TRÒ CHƠI MỚI RA HAY QUÁ NHỈ,VIVOSSPK17, Trò chơi mới ra hay quá nhỉ!,1.0,4.119372367858887,3.713916301727295,0.0
VIVOSSPK18_274,./tiengviet/vivos_data/train/waves/VIVOSSPK18/VIVOSSPK18_274.wav,1.90625,XỬ LÝ NGÔN NGỮ NÓI,VIVOSSPK18, Xử lý ngôn ngữ nói,1.0,4.337430000305176,3.523943424224853,0.0
VIVOSSPK35_112,./tiengviet/vivos_data/train/waves/VIVOSSPK35/VIVOSSPK35_112.wav,13.75,NHỮNG BÁC SĨ ĐANG NGÀY ĐÊM CHỮA TRỊ CHO CÁC BỆNH NHI RẤT BẤT NGỜ KHI NHẬN ĐƯỢC MÓN QUÀ LÀ TRÁI BÓNG TỪ CÁC CẦU THỦ,VIVOSSPK35, Những bác sĩ đang ngày đêm chữa trị cho các bệnh nhi rất bất ngờ khi nhận được món quà là trái bóng từ các cầu thủ.,1.0,4.283990859985352,3.5702123641967773,0.0
VIVOSSPK09_R111,./tiengviet/vivos_data/train/waves/VIVOSSPK09/VIVOSSPK09_R111.wav,3.0625,VÀ CHƠ VƠ NHƯ MỘT NHÁNH CỎ,VIVOSSPK09, Và chơ vơ như một nhánh cỏ.,1.0,4.069589614868164,3.756007671356201,0.0
VIVOSSPK08_R061,./tiengviet/vivos_data/train/waves/VIVOSSPK08/VIVOSSPK08_R061.wav,4.375,DUY TRÌ NGÔI VỊ ĐẦU BẢNG TRÊN THỊ TRƯỜNG ĐANG CẠNH TRANH GAY GẮT,VIVOSSPK08, duy trì ngôi vị đầu bản trên thị trường đang cạnh tranh gây gắt.,1.0,4.325319290161133,3.5333456993103027,0.0
VIVOSSPK22_148,./tiengviet/vivos_data/train/waves/VIVOSSPK22/VIVOSSPK22_148.wav,4.46875,VÌ TẤT CẢ VIỆC ĐẠI TIỂU TIỆN ĐỀU DIỄN RA Ở ĐÓ,VIVOSSPK22, Vì tất cả việc đại tiểu tiền đều diễn ra ở đó.,1.0,4.220686435699463,3.621072769165039,0.0
VIVOSSPK18_182,./tiengviet/vivos_data/train/waves/VIVOSSPK18/VIVOSSPK18_182.wav,1.9375,ĐẠI PHÓ BÁO CHO THUYỀN TRƯỞNG,VIVOSSPK18, Đại phó báo cho thuyền trưởng,1.0,4.599766731262207,3.290930986404419,0.0
VIVOSSPK29_067,./tiengviet/vivos_data/train/waves/VIVOSSPK29/VIVOSSPK29_067.wav,5.8125,NGÀNH SẼ TIẾP TỤC HỢP TÁC VỚI CƠ QUAN HỮU QUAN ĐỂ LÀM RÕ VỤ VIỆC,VIVOSSPK29, Ngành sẽ tiếp tục hợp tác với cơ quan hữu quan để làm rõ vụ việc.,1.0,4.468807697296143,3.403475284576416,0.0
VIVOSSPK29_098,./tiengviet/vivos_data/train/waves/VIVOSSPK29/VIVOSSPK29_098.wav,6.4375,THUỐC VÀ PHÚT DẠI KHỜ CỦA TUỔI TRẺ ĐÃ ĐƯA NGƯỜI CON TRAI ĐÓ BƯỚC RA KHỎI TRẦN THẾ,VIVOSSPK29, Thuốc và phúc giải khờ của tuổi trẻ đã đưa người con trai đó bước ra khỏi trần thế,1.0,4.875329494476318,3.163710355758667,0.0526315789473684
VIVOSSPK17_016,./tiengviet/vivos_data/train/waves/VIVOSSPK17/VIVOSSPK17_016.wav,3.125,NHÀ NÀY ĐÃ KỊP LÚN ÍT NHẤT MỘT TẦNG RỒI,VIVOSSPK17, Nhà này đã kịp lún ít nhất một tầng rồi.,1.0,4.635377883911133,3.256721973419189,0.0
VIVOSSPK12_T028,./tiengviet/vivos_data/train/waves/VIVOSSPK12/VIVOSSPK12_T028.wav,3.25,ĐÔNG PHONG DẪU NHẸ RỤNG TRĂM HOA,VIVOSSPK12, Đông phong dẫu nhẹ rụng trăm hoa,1.0,4.425867080688477,3.4383344650268555,0.0
VIVOSSPK22_274,./tiengviet/vivos_data/train/waves/VIVOSSPK22/VIVOSSPK22_274.wav,3.0625,TÔI CHẾT CÙNG VỚI ÁNH TRĂNG,VIVOSSPK22, Tôi chết cùng với ánh trăng,1.0,3.82793402671814,3.95793890953064,0.0
VIVOSSPK08_R134,./tiengviet/vivos_data/train/waves/VIVOSSPK08/VIVOSSPK08_R134.wav,3.78125,NGAY VIỆC DẠY CHƯƠNG TRÌNH MỚI CÒN CHƯA HẾT BỠ NGỠ,VIVOSSPK08, Ngay việc dạy chương trình mới còn chưa hết bở ngỡ.,1.0,4.391109466552734,3.667379379272461,0.0909090909090909
VIVOSSPK07_R198,./tiengviet/vivos_data/train/waves/VIVOSSPK07/VIVOSSPK07_R198.wav,3.78125,DO RỐI LOẠN KHỚP THÁI DƯƠNG HÀM,VIVOSSPK07, Do rối loạn khớp Thái Dương Hàm,1.0,4.057183265686035,3.758378505706787,0.0
VIVOSSPK15_011,./tiengviet/vivos_data/train/waves/VIVOSSPK15/VIVOSSPK15_011.wav,4.65625,GẦN NHƯ ĐA SỐ CÁC ĐẢNG LỚN TRONG LỰC LƯỢNG TRUNG TẢ,VIVOSSPK15, gần như đa số các đảng lớn trong lực lượng trung tả.,1.0,4.264548301696777,3.577760934829712,0.0
VIVOSSPK07_T045,./tiengviet/vivos_data/train/waves/VIVOSSPK07/VIVOSSPK07_T045.wav,3.0625,CHỈ BIẾT THAN THÂN TRÁCH PHẬN LÀ GIỎI,VIVOSSPK07, Chỉ biết thăng thân trách phận là giỏi,1.0,4.160067558288574,3.668219327926636,0.0
VIVOSSPK36_118,./tiengviet/vivos_data/train/waves/VIVOSSPK36/VIVOSSPK36_118.wav,3.625,TÔI CHO RẰNG VIỆC ĐÁNH THUẾ THU NHẬP CỦA CÁC CA SĨ LÀ RẤT KHÓ,VIVOSSPK36, Tôi cho rằng việc đánh thuế thu nhập của các ca sĩ là rất khó.,1.0,4.458950042724609,3.4083127975463867,0.0
VIVOSSPK08_R124,./tiengviet/vivos_data/train/waves/VIVOSSPK08/VIVOSSPK08_R124.wav,3.375,ĐỂ CHÚNG ĐI NGỦ LẠI MÀ KHÔNG THỨC GIẤC NỮA,VIVOSSPK08, để chúng đi ngủ lại mà không thức giấc nữa.,1.0,4.213159084320068,3.6209778785705566,0.0
VIVOSSPK09_R150,./tiengviet/vivos_data/train/waves/VIVOSSPK09/VIVOSSPK09_R150.wav,2.875,DO CHÊNH LỆCH GIỮA GIÁ BÁN,VIVOSSPK09, Do trên lệch giữa giá bán,1.0,4.046304702758789,3.765832901000977,0.0
VIVOSSPK18_266,./tiengviet/vivos_data/train/waves/VIVOSSPK18/VIVOSSPK18_266.wav,2.4375,NHƯNG ĐẤT NƯỚC ĐÃ CHỌN MỘT NHÀ LÃNH ĐẠO KHÁC,VIVOSSPK18, Nhưng đất nước đã chọn một nhà lãnh đạo khác,1.0,4.634944915771484,3.2534937858581543,0.0
VIVOSSPK08_R014,./tiengviet/vivos_data/train/waves/VIVOSSPK08/VIVOSSPK08_R014.wav,3.21875,HỌ ĐÃ PHẢI VAY NHỮNG KHOẢN TIỀN RẤT LỚN,VIVOSSPK08, Họ đã phải vây những khoản tiền rất lớn,1.0,4.263813495635986,3.5746490955352783,0.0
VIVOSSPK15_157,./tiengviet/vivos_data/train/waves/VIVOSSPK15/VIVOSSPK15_157.wav,4.0625,TAY KIA XÁCH MỘT TAY GIÓNG MANG CHIẾC VỊM LỚN,VIVOSSPK15, Tai kia sách một tai giống mang chiếc việm lớn.,1.0,4.195649147033691,3.852882623672485,0.1
VIVOSSPK09_R199,./tiengviet/vivos_data/train/waves/VIVOSSPK09/VIVOSSPK09_R199.wav,3.15625,DO MỸ ĐỨNG ĐẦU CHỈ LÀ TẠM THỜI,VIVOSSPK09, Do Mỹ đứng đầu chỉ là tạm thời,1.0,4.118131637573242,3.7010107040405273,0.0
VIVOSSPK07_R199,./tiengviet/vivos_data/train/waves/VIVOSSPK07/VIVOSSPK07_R199.wav,2.84375,ĐÉO GÌ MÀ PHẢI GHÊ THẾ,VIVOSSPK07, Đéo gì mà phải ghê thế,1.0,4.003522396087647,3.8005409240722656,0.0
VIVOSSPK29_096,./tiengviet/vivos_data/train/waves/VIVOSSPK29/VIVOSSPK29_096.wav,7.8125,MƠ ƯỚC CHỈ MỚI THỰC HIỆN ĐƯỢC MỘT PHẦN PHẦN CÒN LẠI LÀ CHẶNG ĐƯỜNG LUYỆN TẬP GIAN KHỔ PHÍA TRƯỚC CHIẾN NÓI,VIVOSSPK29," Mơ ước chỉ mới thực hiện được một phần, phần còn lại là chặn đường luyện tập gian khổ phía trước, Chiến nói.",1.0,4.425784111022949,3.432417154312134,0.0
VIVOSSPK12_T047,./tiengviet/vivos_data/train/waves/VIVOSSPK12/VIVOSSPK12_T047.wav,3.5,PHIÊN BẢN ĐẦU TIÊN RA MẮT THỨ BẢY TUẦN TRƯỚC,VIVOSSPK12, phiên bản đầu tiên ra mắt thứ 7 tuần trước.,1.0,4.458032608032227,3.622441530227661,0.1
VIVOSSPK22_122,./tiengviet/vivos_data/train/waves/VIVOSSPK22/VIVOSSPK22_122.wav,3.4375,SỐNG TRONG ĐÔ THỊ VÀ CÁC VÙNG LÂN CẬN,VIVOSSPK22, Sống trong đô thị và các vùng lanh cạnh,1.0,4.350916862487793,3.49609923362732,0.0
VIVOSSPK20_005,./tiengviet/vivos_data/train/waves/VIVOSSPK20/VIVOSSPK20_005.wav,4.03125,CHỈ CÓ ĐIỀU CÔ TA MANG GIÀY CHIẾC VÁY LEN DÀI BẰNG LÔNG CỪU,VIVOSSPK20, Chỉ có điều cô ta mang dài chiếc vấy len dài bằng lông cừu.,1.0,4.371681213378906,3.6335952281951904,0.0714285714285714
VIVOSSPK07_R128,./tiengviet/vivos_data/train/waves/VIVOSSPK07/VIVOSSPK07_R128.wav,4.25,MÁI TÓC BẠC CỦA BÀ XÒA TRÊN KHUÔN MẶT THÂN THƯƠNG,VIVOSSPK07, Mái tóc bạc của bà xòa trên khuôn mặt thân thương,1.0,4.267337799072266,3.5676305294036865,0.0
VIVOSSPK18_103,./tiengviet/vivos_data/train/waves/VIVOSSPK18/VIVOSSPK18_103.wav,2.4375,LÀ NHỮNG LẦN THAY ĐỔI NƠI HỌC HÀNH,VIVOSSPK18, Là những lần thay đổi nơi học hành,1.0,4.187268733978272,3.637179374694824,0.0
VIVOSSPK15_141,./tiengviet/vivos_data/train/waves/VIVOSSPK15/VIVOSSPK15_141.wav,3.875,ĐÁM CƯỚI HAY GIỖ QUẢI NHÀ NÀO NHÀ NẤY,VIVOSSPK15, Đám cưới hay vỗ quải nhà nào nhà nấy?,1.0,3.93534779548645,4.099335670471191,0.1111111111111111
VIVOSSPK36_011,./tiengviet/vivos_data/train/waves/VIVOSSPK36/VIVOSSPK36_011.wav,4.40625,DƯỜNG NHƯ SỰ QUAN TÂM NỒNG NHIỆT CỦA CÔNG CHÚNG CŨNG LÀM BAN TỔ CHỨC BỐI RỐI,VIVOSSPK36, Dường như sự quan tâm nồng nhiệt của công chúng cũng làm ban tổ chức bối rối.,1.0,4.426727771759033,3.428529739379883,0.0
VIVOSSPK20_041,./tiengviet/vivos_data/train/waves/VIVOSSPK20/VIVOSSPK20_041.wav,2.8125,TRỪ KHI BẠN BIẾT TÔN TRỌNG BẢN THÂN MÌNH,VIVOSSPK20, trừ khi bạn biết tôn trọng bản thân mình.,1.0,4.43110466003418,3.4238297939300537,0.0
VIVOSSPK15_071,./tiengviet/vivos_data/train/waves/VIVOSSPK15/VIVOSSPK15_071.wav,3.5625,TÔI THƯỜNG HỎI CHA SỰ TÍCH VỀ NHỮNG GIỌT MỒ HÔI,VIVOSSPK15, Tôi thường hỏi cha sự tích về những giọt mồ hôi.,1.0,4.210331916809082,3.6146841049194336,0.0
VIVOSSPK36_194,./tiengviet/vivos_data/train/waves/VIVOSSPK36/VIVOSSPK36_194.wav,6.5,XEM QUA CÓ VẺ NHƯ KHÔNG DÍNH DÁNG ĐẾN NHAU SONG TRONG THỰC TẾ HAI CÁI TAI NÀY RẤT THƯỜNG CÓ CƠ HỘI CỘNG HƯỞNG,VIVOSSPK36, Xem qua có vẻ như không dính dán đến nhau Xong trong thực tế Hai cái tay này rất thường có cơ hội cộng hưởng,1.0,4.441053867340088,3.4134292602539062,0.0
VIVOSSPK18_010,./tiengviet/vivos_data/train/waves/VIVOSSPK18/VIVOSSPK18_010.wav,3.875,MỘT SỐ KHÁC HÀNH ĐỘNG CHẬM HƠN,VIVOSSPK18, Một số khác hành động chậm hơn.,1.0,4.225805759429932,3.599675416946411,0.0
VIVOSSPK15_094,./tiengviet/vivos_data/train/waves/VIVOSSPK15/VIVOSSPK15_094.wav,5.6875,CHÍNH BÀ CŨNG LÀ NGƯỜI NUNG NẤU NIỀM ĐAM MÊ DIỄN XUẤT CỦA CÔ CON GÁI,VIVOSSPK15, Chính bà cũng là người nung nấu niềm đam mê diễn xuất của cô con gái.,1.0,4.143455982208252,3.671038866043091,0.0
VIVOSSPK27_236,./tiengviet/vivos_data/train/waves/VIVOSSPK27/VIVOSSPK27_236.wav,9.03125,CHÚNG TÔI CỨ THẾ MÀ NHỒI SỌ NHỮNG CÂU HỎI VÀ CÂU TRẢ LỜI TRONG TÀI LIỆU ĐÓ,VIVOSSPK27, Chúng tôi cứ thế mà nhồi so những câu hỏi và câu trả lời trong tài liệu đó.,1.0,4.299588203430176,3.656160354614258,0.0555555555555555
VIVOSSPK12_R199,./tiengviet/vivos_data/train/waves/VIVOSSPK12/VIVOSSPK12_R199.wav,4.90625,BỘ PHẬN PHỎNG VẤN TUYỂN DỤNG TẠI CÁC CƠ QUAN CHÍNH PHỦ,VIVOSSPK12, Bộ phận phỏng vấn tiện dụng tại các cơ quan chính phủ,1.0,4.3321051597595215,3.50596570968628,0.0
VIVOSSPK29_134,./tiengviet/vivos_data/train/waves/VIVOSSPK29/VIVOSSPK29_134.wav,8.75,NGUYỄN NGỌC TRUNG BÊN TƯỢNG BÁN THÂN NHÀ TOÁN HỌC LÊ VĂN THIÊM Ở VIỆN TOÁN HỌC VIỆT NAM ẢNH VIỆT DŨNG,VIVOSSPK29," Nguyễn Ngọc Trung bên tượng bán thân nhà toán học Lê Văn Thiêm ở Viện Toán học Việt Nam, ảnh Việt Dũng.",1.0,4.327696800231934,3.509645462036133,0.0
VIVOSSPK12_R099,./tiengviet/vivos_data/train/waves/VIVOSSPK12/VIVOSSPK12_R099.wav,2.75,TRUNG TÂM NÀY CÒN CUNG CẤP CÁC THÔNG TIN,VIVOSSPK12, Trung tâm này còn cung cấp các thông tin.,1.0,4.326954364776611,3.509657144546509,0.0
VIVOSSPK08_R117,./tiengviet/vivos_data/train/waves/VIVOSSPK08/VIVOSSPK08_R117.wav,2.625,VỚI MỘT NỮ NHÂN VIÊN CÒN ĐỘC THÂN,VIVOSSPK08," Với một nữ nhân viên còn độc thân,",1.0,4.097038269042969,3.709227085113525,0.0
VIVOSSPK15_029,./tiengviet/vivos_data/train/waves/VIVOSSPK15/VIVOSSPK15_029.wav,5.4375,VÀ ĐIỀU NÀY HẦU NHƯ KHÔNG CÒN GÂY BẤT NGỜ CHO GIỚI CHUYÊN MÔN,VIVOSSPK15, Và điều này hầu như không còn gây bất ngờ cho giới chuyên môn.,1.0,4.309934139251709,3.523333787918091,0.0
VIVOSSPK46_090,./tiengviet/vivos_data/train/waves/VIVOSSPK46/VIVOSSPK46_090.wav,4.561875,NẾU CỨ ĐI TRUY TÌM KẺ ĐẦU CƠ NÂNG GIÁ THÌ SẼ KHÓ TÌM RA,VIVOSSPK46, Nếu cứ truy tìm kẻ đầu cơ nâng giá thì sẽ khó tìm ra,1.0,4.211273193359375,3.75455904006958,0.0666666666666666
VIVOSSPK29_154,./tiengviet/vivos_data/train/waves/VIVOSSPK29/VIVOSSPK29_154.wav,8.625,NÓI CHUNG QUẢN LÝ Ở CHÂU ÂU VỐN DĨ THỜ Ơ VỚI NGƯỜI NGOÀI NAY TRỞ NÊN NĂNG ĐỘNG CHÚ Ý VÀ QUAN TÂM ĐẾN CỔ ĐÔNG HƠN,VIVOSSPK29," Nói chung, quản lý ở châu Âu vốn dĩ thờ ơ với người ngoài nay trở nên năng động chú ý và quan tâm đến cổ đông hơn.",1.0,4.522188186645508,3.338158130645752,0.0
VIVOSSPK18_176,./tiengviet/vivos_data/train/waves/VIVOSSPK18/VIVOSSPK18_176.wav,2.75,HÀNG NGÀY GỖ KIỀN KIỀN NẶNG TRỊCH MỞ RA,VIVOSSPK18, Hằng ngày gỗ kiền kiền nặng trịch mở ra.,1.0,4.419203758239746,3.427513599395752,0.0
VIVOSSPK22_188,./tiengviet/vivos_data/train/waves/VIVOSSPK22/VIVOSSPK22_188.wav,3.6875,ĐẠO DIỄN CUỘC KHỔ NẠN CỦA CHÚA,VIVOSSPK22, Đạo diễn cuộc khổ nạn của Chúa,1.0,3.992943048477173,3.797294855117798,0.0
VIVOSSPK36_057,./tiengviet/vivos_data/train/waves/VIVOSSPK36/VIVOSSPK36_057.wav,4.875,SỐ DIỆN TÍCH THANH LONG CÓ MÃ SỐ CÒN LẠI THUỘC HAI TỈNH TIỀN GIANG VÀ LONG AN,VIVOSSPK36, Số diện tích Thanh Long có mã còn lại thuộc 2 tỉnh Tiền Giang và Long An.,1.0,4.494687557220459,3.6040267944335938,0.1111111111111111
VIVOSSPK07_R086,./tiengviet/vivos_data/train/waves/VIVOSSPK07/VIVOSSPK07_R086.wav,4.0625,CÙNG MÓN THỊT VỊT LÀM MỀM LƯỠI CÁC VỊ GIÁM KHẢO,VIVOSSPK07, Cùng món thịt vịt làm mềm lưỡi các vị giám khảo,1.0,4.273262023925781,3.55202054977417,0.0
VIVOSSPK07_R116,./tiengviet/vivos_data/train/waves/VIVOSSPK07/VIVOSSPK07_R116.wav,3.5625,NẾU KHÔNG ĐƯỢC YÊU CẦU,VIVOSSPK07, Nếu không được yêu cầu,1.0,4.109370708465576,3.694359302520752,0.0
VIVOSSPK12_R114,./tiengviet/vivos_data/train/waves/VIVOSSPK12/VIVOSSPK12_R114.wav,5.34375,NÉT SON ẤY ĐƯỢC KHƠI MÀO VẼ NÊN BẰNG SỰ CHUNG TAY CỦA ĐÔI UYÊN ƯƠNG,VIVOSSPK12, Nét son ấy được khơi màu vẽ nên bằng sự chung tay của đôi yên ương.,1.0,4.193392276763916,3.6204426288604736,0.0
VIVOSSPK08_T016,./tiengviet/vivos_data/train/waves/VIVOSSPK08/VIVOSSPK08_T016.wav,4.40625,KHÔNG SỢ THIÊN HẠ CƯỜI CHÊ CHỈ SỢ KHÔNG MÊ ĐÀN BÀ,VIVOSSPK08, Không sợ thiên hạ cười chê chỉ sợ không mê đàn bà,1.0,4.071138381958008,3.726640939712525,0.0
VIVOSSPK15_155,./tiengviet/vivos_data/train/waves/VIVOSSPK15/VIVOSSPK15_155.wav,2.40625,ĐỂ DUY TRÌ CA TRỰC ỔN ĐỊNH,VIVOSSPK15, để duy trì ca trực ổn định.,1.0,3.9315602779388414,3.847220659255981,0.0
VIVOSSPK20_186,./tiengviet/vivos_data/train/waves/VIVOSSPK20/VIVOSSPK20_186.wav,1.8125,CÔNG TY NÀY BỊ CÁO BUỘC,VIVOSSPK20, Công ty này bị cáo buộc,1.0,4.034619331359863,3.757217168807984,0.0
VIVOSSPK29_120,./tiengviet/vivos_data/train/waves/VIVOSSPK29/VIVOSSPK29_120.wav,7.125,HOẶC CÁC BÀI VIẾT PHẢN ÁNH KHÔNG KHÍ ĐÓN TẾT HOẶC KỂ VỀ CÁC PHONG TỤC Ở CHÍNH ĐỊA PHƯƠNG MÌNH,VIVOSSPK29, hoặc các bài viết phản ánh không khí đón Tết hoặc kể về các phong tộc ở chính địa phương mình.,1.0,4.670175552368164,3.2047693729400635,0.0
VIVOSSPK08_R069,./tiengviet/vivos_data/train/waves/VIVOSSPK08/VIVOSSPK08_R069.wav,2.8125,DO TRÚNG QUÁ NHIỀU ĐẠN CỦA BỌN KHỦNG BỐ,VIVOSSPK08, do trúng quá nhiều đạn của bọn khủng bố.,1.0,4.113440990447998,3.688152313232422,0.0
VIVOSSPK08_R113,./tiengviet/vivos_data/train/waves/VIVOSSPK08/VIVOSSPK08_R113.wav,3.71875,NHƯNG BẠN PHẢI NGON NGỌT VỚI HỌ TRONG SUỐT THỜI GIAN LÀM VIỆC,VIVOSSPK08, nhưng bạn phải ngon ngọt với họ trong suốt thời gian làm việc.,1.0,4.057478904724121,3.7365221977233887,0.0
VIVOSSPK18_289,./tiengviet/vivos_data/train/waves/VIVOSSPK18/VIVOSSPK18_289.wav,2.4375,HAI BA NẰM RỒI MÌNH QUEN NHAU PHẢI KHÔNG NHUNG,VIVOSSPK18, Hai ba năm rồi mình quen nhau phải không Nhung?,1.0,4.355622291564941,3.6962130069732666,0.1
VIVOSSPK20_095,./tiengviet/vivos_data/train/waves/VIVOSSPK20/VIVOSSPK20_095.wav,3.375,CÁI TÔI CẦN LÀ HÌNH ẢNH MỘT CON BÉ CON BA TUỔI,VIVOSSPK20, Cái tôi cần là hình ảnh một con bé con 3 tuổi.,1.0,4.447216987609863,3.5793004035949707,0.0833333333333333
VIVOSSPK20_013,./tiengviet/vivos_data/train/waves/VIVOSSPK20/VIVOSSPK20_013.wav,1.5625,SỐNG CẠNH SÔNG GIANH,VIVOSSPK20, Sống cạnh sông răng,1.0,4.02987003326416,3.7592053413391113,0.0
VIVOSSPK22_266,./tiengviet/vivos_data/train/waves/VIVOSSPK22/VIVOSSPK22_266.wav,2.84375,HAI LÀ CÓ THÊM HAI NGUYỆN VỌNG NỮA,VIVOSSPK22, Hay là có thêm 2 nguyện vòng nữa?,1.0,4.42286491394043,3.965211868286133,0.25
VIVOSSPK18_142,./tiengviet/vivos_data/train/waves/VIVOSSPK18/VIVOSSPK18_142.wav,2.375,CÔNG VIỆC ỘN LÊN LÀM KHÔNG XUỂ,VIVOSSPK18, Công việc ổn lên làm không sợi.,1.0,4.442239761352539,4.026227951049805,0.2857142857142857
VIVOSSPK35_227,./tiengviet/vivos_data/train/waves/VIVOSSPK35/VIVOSSPK35_227.wav,9.875,TIẾNG CỔ NHẠC TỪ CỎ TỪ ĐÁ TỪ CÂY QUẤN THEO BƯỚC CHÂN DU KHÁCH,VIVOSSPK35," Tiếng cổ nhạc từ cỏ, từ đá, từ cây quấn theo bước chân du khách.",1.0,4.093012809753418,3.7035880088806152,0.0
VIVOSSPK22_235,./tiengviet/vivos_data/train/waves/VIVOSSPK22/VIVOSSPK22_235.wav,3.25,BẢY MƯƠI SÁU BẢY MƯƠI BẢY,VIVOSSPK22," Bảy mươi sáu, bảy mươi bảy.",1.0,3.840922117233277,3.922585248947144,0.0
VIVOSSPK09_T022,./tiengviet/vivos_data/train/waves/VIVOSSPK09/VIVOSSPK09_T022.wav,2.4375,CHÀO ANH EM TÊN HẠNH,VIVOSSPK09, Chào anh em tên Hạnh,1.0,4.176779747009277,3.630523681640625,0.0
VIVOSSPK20_033,./tiengviet/vivos_data/train/waves/VIVOSSPK20/VIVOSSPK20_033.wav,2.3125,PHẠT ĐỨT CHỒI NHỮNG QUẢ DỨA NON,VIVOSSPK20, Phạt đức trời những quả dứa non,1.0,4.439798831939697,3.401512861251831,0.0
VIVOSSPK20_192,./tiengviet/vivos_data/train/waves/VIVOSSPK20/VIVOSSPK20_192.wav,2.25,THAY VÀO ĐÓ TỐT HƠN BẠN HÃY SỬ DỤNG,VIVOSSPK20, Thay vào đó tốt hơn bạn hãy sử dụng.,1.0,4.470422744750977,3.374570369720459,0.0
VIVOSSPK08_R185,./tiengviet/vivos_data/train/waves/VIVOSSPK08/VIVOSSPK08_R185.wav,1.96875,ĐẾN LÚC ÔNG BÁC SĨ CẤM,VIVOSSPK08, Đến lúc ông bác sĩ cấm.,1.0,4.049969673156738,3.7394802570343018,0.0
VIVOSSPK46_156,./tiengviet/vivos_data/train/waves/VIVOSSPK46/VIVOSSPK46_156.wav,4.936875,ÔNG NGỌ NÓI ĐANG CHO CÁC TÀU LỚN RA GỌI SỐ TÀU NÀY VỀ,VIVOSSPK46, Ông ngọt nói đây cho các tàu lớn ra gọi số tàu này về,1.0,3.9782803058624254,3.8014440536499023,0.0
VIVOSSPK07_R193,./tiengviet/vivos_data/train/waves/VIVOSSPK07/VIVOSSPK07_R193.wav,3.375,CHO PHÉP HAI NGƯỜI CÙNG THAM GIA,VIVOSSPK07, Cho phép hai người cùng tham gia.,1.0,3.991548776626587,3.788394927978516,0.0
VIVOSSPK18_072,./tiengviet/vivos_data/train/waves/VIVOSSPK18/VIVOSSPK18_072.wav,2.375,HÃY GIẢM KHÍ THẢI VÀ NHANH CHÓNG,VIVOSSPK18, Hãy giảm khí thải và nhanh chóng!,1.0,4.212559700012207,3.596156120300293,0.0
VIVOSSPK29_070,./tiengviet/vivos_data/train/waves/VIVOSSPK29/VIVOSSPK29_070.wav,8.0625,NHƯ VẬY BẠN KHÔNG THỂ THI CÙNG KHỐI CÙNG ĐỢT VÀO TRƯỜNG CÓ TỔ CHỨC THI VÀ KHÔNG TỔ CHỨC THI ĐƯỢC,VIVOSSPK29, Như vậy bạn không thể thi cùng khói cùng đợt vào trường có tổ chức thi và không tổ chức thi được.,1.0,4.615612030029297,3.24410080909729,0.0
VIVOSSPK15_081,./tiengviet/vivos_data/train/waves/VIVOSSPK15/VIVOSSPK15_081.wav,3.5625,CON NHỎ MỞ CÁI TÚI GÚT ĐEO TRÊN CỔ,VIVOSSPK15, Con nhỏ mở cái túi Wooddale trên cổ.,1.0,4.318097114562988,3.745805978775024,0.1111111111111111
VIVOSSPK09_T023,./tiengviet/vivos_data/train/waves/VIVOSSPK09/VIVOSSPK09_T023.wav,2.875,CHÀO EM BÀ NỘI CỦA ANH CŨNG TÊN HẠNH,VIVOSSPK09," Chào em, bà nội của anh cũng tên Hạnh.",1.0,4.3253045082092285,3.4952471256256104,0.0
VIVOSSPK27_097,./tiengviet/vivos_data/train/waves/VIVOSSPK27/VIVOSSPK27_097.wav,4.3125,NỖI LO ÂU CỦA TOÀN BỘ DÂN CHÚNG VỀ HỘI NGHỊ NÀY ĐẶC BIỆT LỚN,VIVOSSPK27, Nỗi lo âu của toàn bộ dân chúng về hội nghị này đặc biệt là,1.0,4.544772148132324,3.449995279312134,0.0666666666666666
VIVOSSPK15_142,./tiengviet/vivos_data/train/waves/VIVOSSPK15/VIVOSSPK15_142.wav,4.0625,TRONG KHI TÚI TIỀN CỦA NGƯỜI CHÂU ÂU LẠI DƯ DẢ,VIVOSSPK15, Trong khi túi tiền của người châu Âu lại dư giã.,1.0,4.311172962188721,3.7060821056365967,0.0909090909090909
VIVOSSPK20_114,./tiengviet/vivos_data/train/waves/VIVOSSPK20/VIVOSSPK20_114.wav,1.6875,LÀM BAO BỘNG ĐỂ CHỐNG SẠT LỞ,VIVOSSPK20, Làm bao bọng để chống sạt lỡ,1.0,4.595010757446289,3.5713908672332764,0.1428571428571428
VIVOSSPK29_150,./tiengviet/vivos_data/train/waves/VIVOSSPK29/VIVOSSPK29_150.wav,5.0,BẰNG CÁCH PHÂN QUYỀN CHÚNG TA CÓ THỂ LÀM NHIỀU VIỆC TRONG CÙNG MỘT THỜI GIAN,VIVOSSPK29, bằng cách phân quyền chúng ta có thể làm nhiều việc trong cùng một thời gian.,1.0,4.355411529541016,3.466531276702881,0.0
VIVOSSPK22_057,./tiengviet/vivos_data/train/waves/VIVOSSPK22/VIVOSSPK22_057.wav,3.625,HẦU HẾT NHỮNG NGƯỜI CÓ KHẢ NĂNG CÂN BẰNG TỐT,VIVOSSPK22, Hầu hết những người có khả năng canh bằng tốt.,1.0,4.242527008056641,3.5634145736694336,0.0
VIVOSSPK12_R175,./tiengviet/vivos_data/train/waves/VIVOSSPK12/VIVOSSPK12_R175.wav,2.15625,NHIỀU NGÔI NHÀ,VIVOSSPK12, Nhiều ngôi nhà,1.0,3.8952317237854,3.8643507957458496,0.0
VIVOSSPK22_097,./tiengviet/vivos_data/train/waves/VIVOSSPK22/VIVOSSPK22_097.wav,2.6875,CỦA MẠNG LƯỚI TRUYỀN HÌNH NÀY,VIVOSSPK22, của mạng lưới truyền hình này.,1.0,3.864555597305298,3.8906326293945312,0.0
VIVOSSPK15_170,./tiengviet/vivos_data/train/waves/VIVOSSPK15/VIVOSSPK15_170.wav,3.8125,LÒNG ĐỎ TRỨNG GÀ TRỘN VỚI GẠO LỨT PHƠI KHÔ,VIVOSSPK15, Lòng đỏ trứng gà trộn với gạo lứt phơi khô.,1.0,4.433684349060059,3.3955023288726807,0.0
VIVOSSPK29_078,./tiengviet/vivos_data/train/waves/VIVOSSPK29/VIVOSSPK29_078.wav,9.5,CHÍNH TỪ ĐÓ CÔ BẮT TAY VÀO VIỆC KẾT HỢP NHỮNG VẬT DỤNG CÔNG NGHỆ CAO VỚI QUẦN ÁO VÀ NHỮNG PHỤ KIỆN KÈM THEO NHƯ TÚI XÁCH CHẲNG HẠN,VIVOSSPK29, Chính từ đó cô bắt tay vào việc kết hợp những vật dụng công nghệ cao với quần áo và những phụ kiện kèm theo như túi sách chẳng hạn.,1.0,4.456063270568848,3.3758156299591064,0.0
VIVOSSPK12_T043,./tiengviet/vivos_data/train/waves/VIVOSSPK12/VIVOSSPK12_T043.wav,2.5,DÂN VIỆT NAM LÀM ĂN CHỤP GIỰT,VIVOSSPK12, Dân Việt Nam làm ăn chụp giật,1.0,4.205622673034668,3.593449115753174,0.0
