file_name,file_path,duration,transcription,speaker_id,asr_result,wer,MOS_Quality,MOS_Naturalness,TER
VIVOSSPK07_R087,./tiengviet/vivos_data/train/waves/VIVOSSPK07/VIVOSSPK07_R087.wav,6.59375,NHỮNG ĐÀO KÉP SÁNG GIÁ CHO MỘT SÂN KHẤU CẢI LƯƠNG HIỆN ĐẠI,VIVOSSPK07, Những đào kép sáng giá cho một sân khấu cải lương hiện đại,1.0,4.0457048416137695,3.290881395339966,0.0
VIVOSSPK15_115,./tiengviet/vivos_data/train/waves/VIVOSSPK15/VIVOSSPK15_115.wav,3.84375,NGƯỜI TRONG NHÀ CẢ NGÀY KHÔNG NHÌN THẤY MẶT NHAU,VIVOSSPK15, Người trong nhà cả ngày không nhìn thấy mặt nhau,1.0,3.83828353881836,3.470681667327881,0.0
VIVOSSPK22_112,./tiengviet/vivos_data/train/waves/VIVOSSPK22/VIVOSSPK22_112.wav,3.8125,NHỮNG YẾU TỐ TRÊN KẾT HỢP VỚI VỆ SINH KÉM,VIVOSSPK22, Những yếu tố trên kết hợp với vệ sinh cám.,1.0,4.223854064941406,3.1340763568878174,0.0
VIVOSSPK09_R185,./tiengviet/vivos_data/train/waves/VIVOSSPK09/VIVOSSPK09_R185.wav,3.875,CHÚNG TA ĐỀU MUỐN MÌNH THUỘC VỀ MỘT CÁI GÌ ĐÓ,VIVOSSPK09, Chúng ta đều muốn mình thuộc về một cái gì đó.,1.0,3.8108162879943848,3.4930806159973145,0.0
VIVOSSPK07_T047,./tiengviet/vivos_data/train/waves/VIVOSSPK07/VIVOSSPK07_T047.wav,4.0625,THẾ NÀO LÀ HOÀN HẢO,VIVOSSPK07, Thế nào là hoàn hảo?,1.0,3.9849798679351807,3.341549158096313,0.0
VIVOSSPK12_R087,./tiengviet/vivos_data/train/waves/VIVOSSPK12/VIVOSSPK12_R087.wav,4.1875,NGƯỜI DÂN CẦN PHẢI LẮP ĐẶT THIẾT BỊ GIẢI MÃ,VIVOSSPK12, Người dân còn phải lắp đặt thiết bị giải mã,1.0,3.868815660476685,3.442193031311035,0.0
VIVOSSPK08_T041,./tiengviet/vivos_data/train/waves/VIVOSSPK08/VIVOSSPK08_T041.wav,2.125,ĐI UỐNG CÀ PHÊ KHÔNG,VIVOSSPK08, Đi uống cà phê không?,1.0,3.891815662384033,3.4220833778381348,0.0
VIVOSSPK12_R151,./tiengviet/vivos_data/train/waves/VIVOSSPK12/VIVOSSPK12_R151.wav,3.09375,CÓ NHIỀU KHẢ NĂNG TRỞ THÀNH BÃO TUYẾT,VIVOSSPK12, Có nhiều khả năng trở thành bão tuyết,1.0,3.8826420307159424,3.430039405822754,0.0
VIVOSSPK08_R021,./tiengviet/vivos_data/train/waves/VIVOSSPK08/VIVOSSPK08_R021.wav,5.0625,NÊN TỪ ĐẦU NĂM CÁC NHÀ SÁCH NƯỚC NÀY TRÀN NGẬP ĐẦU SÁCH CHÍNH TRỊ,VIVOSSPK08, nên từ đầu năm các nhà sách nước này tràn ngập đầu sách chính trị.,1.0,3.927382707595825,3.3910458087921143,0.0
VIVOSSPK46_045,./tiengviet/vivos_data/train/waves/VIVOSSPK46/VIVOSSPK46_045.wav,5.811875,MÙI DƯA ME MUỐI MÙI BÁNH ME SẤY MÙI TRẦM BA ĐỐT ĐÓN GIAO THỪA,VIVOSSPK46," Mùi dưa me muối, mùi bánh me sấy, mùi trầm ba đốt đón giao thừa",1.0,3.755366563796997,3.5402941703796387,0.0
VIVOSSPK20_169,./tiengviet/vivos_data/train/waves/VIVOSSPK20/VIVOSSPK20_169.wav,3.3125,THÌ PHẢI CHÊM TIẾNG NƯỚC NGOÀI VÀO MỚI ÁC CHIẾN,VIVOSSPK20, thì phải chêm tiếng nước ngoài vào mới ách chiến.,1.0,3.8071677684783936,3.4950973987579346,0.0
VIVOSSPK03_R132,./tiengviet/vivos_data/train/waves/VIVOSSPK03/VIVOSSPK03_R132.wav,2.375,KHI TRỜI BẮT ĐẦU LẠNH VÀ CHẾT,VIVOSSPK03, Khơi trời bắt đầu lạnh và chết,1.0,3.7897000312805176,3.509756565093994,0.0
VIVOSSPK09_R131,./tiengviet/vivos_data/train/waves/VIVOSSPK09/VIVOSSPK09_R131.wav,2.8125,HỎI THƯ ĐÃ ĐƯỢC CHUYỂN CHƯA,VIVOSSPK09, Hỏi thư đã được chuyển chưa?,1.0,4.128000736236572,3.215430974960327,0.0
VIVOSSPK25_180,./tiengviet/vivos_data/train/waves/VIVOSSPK25/VIVOSSPK25_180.wav,5.5,NHỮNG LỖI THÍ SINH THƯỜNG GẶP DẪN ĐẾN MẤT ĐIỂM KHI LÀM BÀI THI TRẮC NGHIỆM,VIVOSSPK25, Những lỗi thí sinh thường gặp dẫn đến mất điểm khi làm bài thi trắc nghiệm,1.0,4.28249979019165,3.081083536148072,0.0
VIVOSSPK12_R098,./tiengviet/vivos_data/train/waves/VIVOSSPK12/VIVOSSPK12_R098.wav,4.15625,NHƯNG TÔI KHÔNG MUỐN BẠN TIN TƯỞNG VÀO BẤT KỲ ĐIỀU GÌ,VIVOSSPK12, Nhưng tôi không muốn bạn tin tưởng vào bất kỳ điều gì.,1.0,3.930624723434448,3.386742115020752,0.0
VIVOSSPK22_192,./tiengviet/vivos_data/train/waves/VIVOSSPK22/VIVOSSPK22_192.wav,5.6875,CHỦ TRƯƠNG TRÊN LÀ ĐÚNG CHỨ KHÔNG PHẢI LẠNH LÙNG,VIVOSSPK22, Trụ trương trên là đúng chứ không phải là lùng.,1.0,4.006071090698242,3.759244918823242,0.2
VIVOSSPK08_R033,./tiengviet/vivos_data/train/waves/VIVOSSPK08/VIVOSSPK08_R033.wav,2.875,CHA TÔI ĐÃ THỀ SÔNG HẸN BIỂN,VIVOSSPK08, Cha tôi đã thề xong hẹn biển.,1.0,3.9996323585510254,3.3264880180358887,0.0
VIVOSSPK46_182,./tiengviet/vivos_data/train/waves/VIVOSSPK46/VIVOSSPK46_182.wav,4.061875,ANH ĐÃ XA TÔI CHỈ BỞI LẼ ANH PHẢI XA TÔI,VIVOSSPK46, Anh đã xa tôi chỉ bởi lẽ anh phải xa tôi,1.0,3.707055568695069,3.580646514892578,0.0
VIVOSSPK12_R014,./tiengviet/vivos_data/train/waves/VIVOSSPK12/VIVOSSPK12_R014.wav,3.625,VỚI HAI CỔ TAY TREO LỦNG LẲNG NHỮNG TÚI XỐP,VIVOSSPK12, Với hai cổ tay treo lũng lẳng những túi xốp,1.0,3.973177671432495,3.5684244632720947,0.1
VIVOSSPK25_179,./tiengviet/vivos_data/train/waves/VIVOSSPK25/VIVOSSPK25_179.wav,6.65625,PHƯỢNG BIẾT KHÔNG ANH CHỜ EM CHÍN ĐỎ TRÁI SẦU CHỜ EM MUỐN BẠC ĐẦU RỒI ĐÂY,VIVOSSPK25, Phượng biết không anh chờ em chín đỏ trái sầu chờ em muốn bạc đầu rồi đây,1.0,4.281621932983398,3.080353260040283,0.0
VIVOSSPK46_120,./tiengviet/vivos_data/train/waves/VIVOSSPK46/VIVOSSPK46_120.wav,4.061875,LÂU KHÔNG GẶP CHẮC BÂY GIỜ CŨNG THAY ĐỔI NHIỀU RỒI ANH NHỈ,VIVOSSPK46, Lâu không gặp chắc bây giờ cũng thay đổi nhiều rồi anh nhỉ,1.0,4.148853302001953,3.1946616172790527,0.0
VIVOSSPK08_R029,./tiengviet/vivos_data/train/waves/VIVOSSPK08/VIVOSSPK08_R029.wav,4.40625,HAI TAY MUỐN XỤI LƠ VÌ PHẢI NÂNG HÀNH LÝ LÊN CAO KẺO ƯỚT,VIVOSSPK08, Hai tay muốn sụi lơ vì phải nâng hành lý lên cao kéo ướt.,1.0,4.139962196350098,3.3586738109588623,0.0714285714285714
VIVOSSPK07_T014,./tiengviet/vivos_data/train/waves/VIVOSSPK07/VIVOSSPK07_T014.wav,2.9375,BUÔNG TAY TUI RA,VIVOSSPK07, Buông tay tôi ra,1.0,3.913178205490112,3.3988192081451416,0.0
VIVOSSPK27_081,./tiengviet/vivos_data/train/waves/VIVOSSPK27/VIVOSSPK27_081.wav,7.375,TUY NHIÊN HẦU HẾT CÁC KHU ĐẤT NÀY ĐỀU CÓ CÔNG TRÌNH XÂY DỰNG CHỈ CÓ HAI KHU ĐẤT TRỐNG,VIVOSSPK27, Tuy nhiên hầu hết các khu đất này đều có công trình xây dựng của hai khu đất trống.,1.0,4.100061416625977,3.345298290252685,0.05
VIVOSSPK15_117,./tiengviet/vivos_data/train/waves/VIVOSSPK15/VIVOSSPK15_117.wav,2.375,NGUỒN TIN CỦA TUỔI TRẺ CHO BIẾT,VIVOSSPK15, Nguồn tin của tuổi trẻ cho biết,1.0,4.252501964569092,3.1026556491851807,0.0
VIVOSSPK12_R109,./tiengviet/vivos_data/train/waves/VIVOSSPK12/VIVOSSPK12_R109.wav,3.625,ĐANG XEM XÉT CÓ ĐƯA RA CÁO BUỘC NÀO HAY KHÔNG,VIVOSSPK12, đang xem xét có đưa ra có buộc nào hay không.,1.0,3.933270692825317,3.3800466060638428,0.0
VIVOSSPK39_095,./tiengviet/vivos_data/train/waves/VIVOSSPK39/VIVOSSPK39_095.wav,5.1875,NÓ KHÔNG CÒN CÁI CẢM GIÁC CỦA NHỮNG NGÀY ĐẦU TÔI ĐẶT CHÂN ĐẾN ĐÂY VÀ GẶP ANH,VIVOSSPK39, Nó không còn cái cảm giác của những ngày đầu tôi đẹp chăng đến đây và gặp anh.,1.0,4.264086723327637,3.0924630165100098,0.0
VIVOSSPK25_162,./tiengviet/vivos_data/train/waves/VIVOSSPK25/VIVOSSPK25_162.wav,9.03125,VỚI TIẾNG ANH GỌI THẦY CÔ CŨNG TRỐNG KHÔNG BẰNG MỘT CÁI TÊN KHÔNG CÓ NHỮNG TIẾNG DẠ THƯA THẦY DẠ THƯA CÔ,VIVOSSPK25, Với tiếng Anh gọi thầy cô cũng trống không bằng một cái tên không có những tiếng dạ thưa thầy dạ thưa cô,1.0,4.176218986511231,3.1688270568847656,0.0
VIVOSSPK20_142,./tiengviet/vivos_data/train/waves/VIVOSSPK20/VIVOSSPK20_142.wav,2.15625,BẰNG CÁCH BỔ SUNG MỘT LOẠI HUYẾT THANH,VIVOSSPK20, Bằng cách bổ sung một loại huyết thanh.,1.0,4.522578239440918,2.867698907852173,0.0
VIVOSSPK45_036,./tiengviet/vivos_data/train/waves/VIVOSSPK45/VIVOSSPK45_036.wav,3.186875,SUỐT CẢ CHẶNG ĐƯỜNG HAI NGƯỜI TRÒ CHUYỆN KHÁ THÂN MẬT,VIVOSSPK45," Suốt cả trận đường, hai người trò chuyện khá thân mật.",1.0,3.749373197555542,3.538984537124634,0.0
VIVOSSPK08_R012,./tiengviet/vivos_data/train/waves/VIVOSSPK08/VIVOSSPK08_R012.wav,3.84375,VÀ CẢM THẤY HẾT SỨC HÀI LÒNG VỚI BẢN THÂN,VIVOSSPK08, và cảm thấy hết sức hài lòng với bản thân.,1.0,4.228549480438232,3.12225604057312,0.0
VIVOSSPK08_R107,./tiengviet/vivos_data/train/waves/VIVOSSPK08/VIVOSSPK08_R107.wav,2.8125,CHO NHỮNG KHU VỰC TRŨNG THẤP TRÊN LƯU VỰC,VIVOSSPK08, cho những khu vực trụng thấp trên lưu vực.,1.0,4.007071495056152,3.558204412460327,0.1111111111111111
VIVOSSPK46_031,./tiengviet/vivos_data/train/waves/VIVOSSPK46/VIVOSSPK46_031.wav,4.561875,CÁC TOA CHỈ GHI HỌ TÊN TUỔI NAM NỮ NGHỀ NGHIỆP ĐỊA CHỈ,VIVOSSPK46," Các ta chỉ ghi họ tên tuổi nam nữ, nghề nghiệp địa chỉ.",1.0,3.9462428092956543,3.3674991130828857,0.0
VIVOSSPK12_R146,./tiengviet/vivos_data/train/waves/VIVOSSPK12/VIVOSSPK12_R146.wav,3.59375,KHI MỌI NGƯỜI ĐÃ NGỒI HẾT VÀO BÀN,VIVOSSPK12, Khi mọi người đã ngồi hết vào bàn,1.0,4.1501078605651855,3.1899490356445312,0.0
VIVOSSPK20_063,./tiengviet/vivos_data/train/waves/VIVOSSPK20/VIVOSSPK20_063.wav,1.9375,TÌNH TRẠNG ĐÓI NGHÈO ĐÃ KHÔNG GIẢM,VIVOSSPK20, Tình trạng đói nghèo đã không giảm,1.0,3.7823233604431152,3.5095605850219727,0.0
VIVOSSPK07_T042,./tiengviet/vivos_data/train/waves/VIVOSSPK07/VIVOSSPK07_T042.wav,5.25,MẸ KIẾP GIỜ NÀY CÒN CHƯA TỚI,VIVOSSPK07, Mẹ kiếp giờ này còn chưa tới,1.0,3.923811912536621,3.3863778114318848,0.0
VIVOSSPK03_R023,./tiengviet/vivos_data/train/waves/VIVOSSPK03/VIVOSSPK03_R023.wav,2.125,VÀ CÁC ĐỒNG NGHIỆP CỦA ANH,VIVOSSPK03, và các đồng nghiệp của anh.,1.0,3.833190441131592,3.4642391204833984,0.0
VIVOSSPK20_030,./tiengviet/vivos_data/train/waves/VIVOSSPK20/VIVOSSPK20_030.wav,1.84375,KHIẾN VINH BUỒN NGỦ,VIVOSSPK20, Khiến Vinh buồn ngủ.,1.0,4.3556809425354,3.0097289085388184,0.0
VIVOSSPK07_T012,./tiengviet/vivos_data/train/waves/VIVOSSPK07/VIVOSSPK07_T012.wav,4.9375,HÔM QUA BÁO ĐĂNG THẦY CHÙA VÔ KHÁCH SẠN,VIVOSSPK07, Hôm qua báo đăng thầy chùa vô khách sạn,1.0,4.165595054626465,3.174385070800781,0.0
VIVOSSPK08_R139,./tiengviet/vivos_data/train/waves/VIVOSSPK08/VIVOSSPK08_R139.wav,3.875,VỀ KHẢ NĂNG QUÁ MỨC NÀY TRONG LĨNH VỰC SẢN XUẤT,VIVOSSPK08, về khả năng quá mức này trong lĩnh vực sản xuất.,1.0,3.9560234546661377,3.355912685394287,0.0
VIVOSSPK46_185,./tiengviet/vivos_data/train/waves/VIVOSSPK46/VIVOSSPK46_185.wav,4.061875,THẬT RA TÔI RẤT SỢ GÀ NUỐT DÂY THUN NÊN LÚC NÀO CŨNG,VIVOSSPK46, Thật ra tôi rất sợ gà nuốt dây thun nên lúc nào cũng...,1.0,3.703495502471924,3.575204610824585,0.0
VIVOSSPK08_R018,./tiengviet/vivos_data/train/waves/VIVOSSPK08/VIVOSSPK08_R018.wav,3.78125,CHỊ VỢ MẮC CỠ KHÔNG NHỊN ĐƯỢC CÁI NGỐC CỦA CHỒNG,VIVOSSPK08, Chị vợ mắc cỡ không nhìn được cái ngóc của chồng.,1.0,3.995445728302002,3.519817352294922,0.0909090909090909
VIVOSSPK39_103,./tiengviet/vivos_data/train/waves/VIVOSSPK39/VIVOSSPK39_103.wav,5.4375,KHÁCH NỮ MỚI KỂ CÁC ANH ĐÃ ĐI DU LỊCH BẰNG LẠC ĐÀ Ở AI CẬP CHƯA,VIVOSSPK39, Khách nữ mới kể các anh đã đi du lịch bèn lạc đà ở Ai Cập chưa?,1.0,4.267106056213379,3.08434534072876,0.0
VIVOSSPK25_160,./tiengviet/vivos_data/train/waves/VIVOSSPK25/VIVOSSPK25_160.wav,6.09375,VÀ CA KHÚC NHẤT LÀ TÌNH CA CỨ PHẢI GIỮ MỘT KHOẢNG CÁCH VỚI ĐỜI SỐNG,VIVOSSPK25, Và ca khúc nhất là tình ca cứ phải giữ một khoảng cách với đời sống,1.0,4.331675052642822,3.0281341075897217,0.0
VIVOSSPK12_R072,./tiengviet/vivos_data/train/waves/VIVOSSPK12/VIVOSSPK12_R072.wav,3.25,NÓ KHIẾN BẠN TRỞ NÊN TỰ TIN HƠN,VIVOSSPK12, Nó khiến bạn trở nên tự tin hơn,1.0,4.018810749053955,3.300031900405884,0.0
VIVOSSPK25_133,./tiengviet/vivos_data/train/waves/VIVOSSPK25/VIVOSSPK25_133.wav,7.75,TÔI CŨNG BIẾT CÓ NHỮNG TIÊU CỰC TRONG GIÁO DỤC VÀ NHÀ TRƯỜNG CŨNG NHƯ NHỮNG LĨNH VỰC KHÁC CỦA XÃ HỘI,VIVOSSPK25, Tôi cũng biết có những tiêu cực trong giáo dục và nhà trường cũng như những lĩnh vực khác của xã hội.,1.0,4.68887186050415,2.717457294464112,0.0
VIVOSSPK07_R030,./tiengviet/vivos_data/train/waves/VIVOSSPK07/VIVOSSPK07_R030.wav,4.6875,SẼ CÓ GIÁ TRỊ THỰC TIỄN SÂU SẮC,VIVOSSPK07, Sẽ có giá trị thực tiễn sâu sắc,1.0,4.209436416625977,3.1340153217315674,0.0
VIVOSSPK09_R050,./tiengviet/vivos_data/train/waves/VIVOSSPK09/VIVOSSPK09_R050.wav,3.4375,BÀ CHỦ ĐANG GIÀNH NHAU MỘT MÓN ĐỒ CHƠI,VIVOSSPK09, Bà chủ đang dành nhau một món đồ chơi,1.0,4.01895809173584,3.54274845123291,0.1111111111111111
VIVOSSPK17_052,./tiengviet/vivos_data/train/waves/VIVOSSPK17/VIVOSSPK17_052.wav,2.75,CUỘC THI NÀY CÓ THỂ TỔ CHỨC TRONG CẢ NƯỚC,VIVOSSPK17, Cuộc thi này có thể tổ chức trong cả nước.,1.0,4.508805751800537,2.873404264450073,0.0
VIVOSSPK17_074,./tiengviet/vivos_data/train/waves/VIVOSSPK17/VIVOSSPK17_074.wav,4.34375,ĐƯỢC ÔNG GIÀ RÂU TÓC BẠC PHƠ NÀY NĂN NỈ ĐẤU MỘT VÁN CỜ,VIVOSSPK17, Được ông già râu tóc bạc phơ này nanh nỉ đấu một ván cờ,1.0,4.654072284698486,2.74711537361145,0.0
VIVOSSPK22_075,./tiengviet/vivos_data/train/waves/VIVOSSPK22/VIVOSSPK22_075.wav,2.84375,LÀ CHỊ LẠI VỘI VÀNG NHỎM NGƯỜI DẬY,VIVOSSPK22, Là gì lại vội vàng nhõm người vậy?,1.0,4.299407958984375,3.603024959564209,0.25
VIVOSSPK17_278,./tiengviet/vivos_data/train/waves/VIVOSSPK17/VIVOSSPK17_278.wav,1.9375,THÁNG NÀY THU NHẬP TỆ QUÁ,VIVOSSPK17, Tháng này thu nhập tệ quá.,1.0,3.7686030864715576,3.515918731689453,0.0
VIVOSSPK45_239,./tiengviet/vivos_data/train/waves/VIVOSSPK45/VIVOSSPK45_239.wav,4.374375,CA KHÚC THẦN TÀI ĐẾN QUA GIỌNG CA CỦA CA SĨ BÍCH HỮU,VIVOSSPK45, Ca khúc Thần Tài đến qua giọng ca của ca sĩ Bích Hữu.,1.0,3.775457859039306,3.509582281112671,0.0
VIVOSSPK12_T038,./tiengviet/vivos_data/train/waves/VIVOSSPK12/VIVOSSPK12_T038.wav,3.25,CÀI ĐẶT LẠI PHẦN MỀM TỐN CẢ NGÀY,VIVOSSPK12, Cài đặt lại phần mềm tốn cả ngày.,1.0,4.306672096252441,3.0475645065307617,0.0
VIVOSSPK15_105,./tiengviet/vivos_data/train/waves/VIVOSSPK15/VIVOSSPK15_105.wav,3.5625,TIẾNG RÍT XÉ TAN MÀN ĐÊM,VIVOSSPK15, Tiếng rít xé tan màng đêm,1.0,3.631541967391968,3.634215831756592,0.0
VIVOSSPK20_115,./tiengviet/vivos_data/train/waves/VIVOSSPK20/VIVOSSPK20_115.wav,3.125,CHÚNG TA PHẢI TỈNH TÁO ĐỐI VỚI NHỮNG THAY ĐỔI NGẦM BÊN TRONG,VIVOSSPK20, Chúng ta phải tỉnh táo đối với những thay đổi ngầm bên trong.,1.0,4.356723785400391,3.0031509399414062,0.0
VIVOSSPK09_T039,./tiengviet/vivos_data/train/waves/VIVOSSPK09/VIVOSSPK09_T039.wav,3.03125,NHƯNG DĨ NHIÊN ĐỪNG BẮT TÔI LÀM LOÀI VẬT,VIVOSSPK09, Nhưng dĩ nhiên đừng bắt tôi làm loại vật.,1.0,4.000066757202148,3.3130481243133545,0.0
VIVOSSPK09_R008,./tiengviet/vivos_data/train/waves/VIVOSSPK09/VIVOSSPK09_R008.wav,2.75,TRONG KHI THI HÀNH CÔNG VỤ,VIVOSSPK09, Trong khi thi hành công vụ,1.0,3.674201011657715,3.596233367919922,0.0
VIVOSSPK29_040,./tiengviet/vivos_data/train/waves/VIVOSSPK29/VIVOSSPK29_040.wav,8.6875,KHI THAY ĐỔI CÂU TRẢ LỜI THÍ SINH CHỌN Ô TRẢ LỜI MỚI VÀ TẨY Ô CŨ THẬT SẠCH TRÁNH LÀM RÁCH PHIẾU TRẢ LỜI,VIVOSSPK29," Khi thay đổi câu trả lờ, thí sinh chọn ô trả lờ mớ và tẩy ô củ thật sạch, tránh làm rách phiếu trả lờ.",1.0,4.499427795410156,2.9664723873138428,0.04
VIVOSSPK22_008,./tiengviet/vivos_data/train/waves/VIVOSSPK22/VIVOSSPK22_008.wav,2.78125,ĐỂ CÓ THỂ TIẾP TỤC HỌC TẬP,VIVOSSPK22, Để có thể tiếp tục học tập,1.0,4.198145389556885,3.139878034591675,0.0
VIVOSSPK22_273,./tiengviet/vivos_data/train/waves/VIVOSSPK22/VIVOSSPK22_273.wav,2.53125,CUNG ĐÀN SAU CUỐI,VIVOSSPK22, Cung đàn sao cuối,1.0,3.6363985538482666,3.628060340881348,0.0
VIVOSSPK46_113,./tiengviet/vivos_data/train/waves/VIVOSSPK46/VIVOSSPK46_113.wav,3.624375,EM SẼ ĐỊNH CƯ BÊN NÀY ANH HIỂU CHO EM NHÉ,VIVOSSPK46," Em sẽ định cơ bên này, anh hiểu cho em nhé.",1.0,3.899641752243042,3.3990731239318848,0.0
VIVOSSPK15_187,./tiengviet/vivos_data/train/waves/VIVOSSPK15/VIVOSSPK15_187.wav,3.28125,ĐANG PHẢN ĐỐI ĐỀ XUẤT THUẾ NÀY,VIVOSSPK15, đang phản đối đề xuất thế này.,1.0,3.956545114517212,3.661986827850342,0.1428571428571428
VIVOSSPK17_062,./tiengviet/vivos_data/train/waves/VIVOSSPK17/VIVOSSPK17_062.wav,3.125,VÀI MIẾNG DƯA CẢI LỚT PHỚT TRONG CƠM,VIVOSSPK17, Vài miếng dưa cải lớp phớt trong cơm,1.0,4.055659294128418,3.262709856033325,0.0
VIVOSSPK09_R166,./tiengviet/vivos_data/train/waves/VIVOSSPK09/VIVOSSPK09_R166.wav,3.59375,KHUYẾT TẬT CỦA CON NGƯỜI LÀ XOI MÓI VÀO CÁI ÁC,VIVOSSPK09, Khuyết tật của con người là sôi mối vào cái ác.,1.0,4.164574146270752,3.1678009033203125,0.0
VIVOSSPK22_236,./tiengviet/vivos_data/train/waves/VIVOSSPK22/VIVOSSPK22_236.wav,3.28125,BẢY MƯƠI TÁM BẢY MƯƠI CHÍN,VIVOSSPK22," Bảy mươi tám, bảy mươi chín.",1.0,3.7388882637023926,3.537668943405152,0.0
VIVOSSPK15_129,./tiengviet/vivos_data/train/waves/VIVOSSPK15/VIVOSSPK15_129.wav,2.625,CỤC ĐÔNG MÁU ĐỦ LỚN,VIVOSSPK15, Cục đông máu đủ lớn,1.0,4.336625576019287,3.017557382583618,0.0
VIVOSSPK22_231,./tiengviet/vivos_data/train/waves/VIVOSSPK22/VIVOSSPK22_231.wav,4.0625,SÁU MƯƠI TÁM SÁU MƯƠI CHÍN,VIVOSSPK22," Sáu mươi tám, sáu mươi chín.",1.0,3.8348190784454346,3.4529898166656494,0.0
VIVOSSPK15_297,./tiengviet/vivos_data/train/waves/VIVOSSPK15/VIVOSSPK15_297.wav,3.75,PHIÊN BẢN ĐẦU TIÊN RA MẮT THỨ BẢY TUẦN TRƯỚC,VIVOSSPK15, Phiên bản đầu tiên ra mắt thứ 7 tuần trước.,1.0,3.794075965881348,3.707417488098145,0.1
VIVOSSPK22_078,./tiengviet/vivos_data/train/waves/VIVOSSPK22/VIVOSSPK22_078.wav,2.4375,Ở CÙNG MỘT KHU VỰC,VIVOSSPK22, ở cùng một khu vực,1.0,3.919502258300781,3.378657341003418,0.0
VIVOSSPK07_R018,./tiengviet/vivos_data/train/waves/VIVOSSPK07/VIVOSSPK07_R018.wav,5.5625,MỖI NGÀY CÓ HÀNG TRĂM NGƯỜI DÂN RA BIỂN DÙNG VỢT VỚT SỨA BÁN,VIVOSSPK07, Mỗi ngày có hàng trăm người dân ra biển dùng vợt vớt sứa bán.,1.0,3.8447089195251465,3.443552017211914,0.0
VIVOSSPK08_R068,./tiengviet/vivos_data/train/waves/VIVOSSPK08/VIVOSSPK08_R068.wav,1.8125,VÂN VÂN VÀ VÂN VÂN,VIVOSSPK08, Vân vân và vân vân.,1.0,4.007591724395752,3.3015856742858887,0.0
VIVOSSPK25_153,./tiengviet/vivos_data/train/waves/VIVOSSPK25/VIVOSSPK25_153.wav,6.21875,NẾU KHÔNG CHUYỂN VẾ TRƯỚC KHI BÌNH PHƯƠNG PHẢI LẬP LUẬN HAI VẾ CÙNG DƯƠNG,VIVOSSPK25, Nếu không chuyển vé trước khi bình phương phải lập luận 2 vé cùng dương.,1.0,4.402462005615234,3.103793144226074,0.0666666666666666
VIVOSSPK46_030,./tiengviet/vivos_data/train/waves/VIVOSSPK46/VIVOSSPK46_030.wav,4.436875,VÌ TRONG KHI THI NHẦM LẪN TRONG ĐỀ THI LÀ RẤT DỄ,VIVOSSPK46," Tùy trong khi thi, nhầm lẫn trong đề thi là rất dễ.",1.0,4.008131504058838,3.300369501113892,0.0
VIVOSSPK09_R183,./tiengviet/vivos_data/train/waves/VIVOSSPK09/VIVOSSPK09_R183.wav,3.0625,MỌI SỰ NGỠ NGÀNG RỒI CŨNG QUA ĐI,VIVOSSPK09, Mọi sự ngỡ ngàng rồi cũng qua đi,1.0,4.052445411682129,3.2616231441497803,0.0
VIVOSSPK09_R033,./tiengviet/vivos_data/train/waves/VIVOSSPK09/VIVOSSPK09_R033.wav,2.96875,CỨ THẾ DƯỚI BÓNG THÔNG NGÀN,VIVOSSPK09, Cứ thế dưới bóng thông ngàn,1.0,3.9458670616149902,3.353954792022705,0.0
VIVOSSPK07_R110,./tiengviet/vivos_data/train/waves/VIVOSSPK07/VIVOSSPK07_R110.wav,6.0,CÓ MỘT THỰC TẾ LÀ NHỮNG NGƯỜI LÀM BẢO TÀNG Ở MỸ,VIVOSSPK07, Có một thực tế là những người làm bảo tàng ở Mỹ,1.0,4.068621635437012,3.2469990253448486,0.0
VIVOSSPK08_R073,./tiengviet/vivos_data/train/waves/VIVOSSPK08/VIVOSSPK08_R073.wav,2.25,LÀ NHỮNG DẤU HIỆU ĐÁNG CHÚ Ý NHẤT,VIVOSSPK08, là những dấu hiệu đáng chú ý nhất.,1.0,4.040194511413574,3.271653652191162,0.0
VIVOSSPK25_164,./tiengviet/vivos_data/train/waves/VIVOSSPK25/VIVOSSPK25_164.wav,7.4375,LỢI DỤNG KHIẾN CHUYỆN CƯỚP GIẬT CÔNG SỨC CỦA NGƯỜI KHÁC ĐANG NGÀY CÀNG CÔNG KHAI MỘT CÁCH TRẮNG TRỢN,VIVOSSPK25, Lợi dụng khiến chuyện cướp vật công sức của người khác đang ngày càng công khai một cách trắng trợn.,1.0,4.51975154876709,2.9640698432922363,0.05
VIVOSSPK07_R078,./tiengviet/vivos_data/train/waves/VIVOSSPK07/VIVOSSPK07_R078.wav,3.96875,BẮC HÀ LÀ MỘT THỊ TRẤN NHỎ,VIVOSSPK07, Bắc Hà là một thị trấn nhỏ,1.0,4.054147720336914,3.259050369262696,0.0
VIVOSSPK17_240,./tiengviet/vivos_data/train/waves/VIVOSSPK17/VIVOSSPK17_240.wav,1.71875,TÁM MƯƠI SÁU TÁM MƯƠI BẢY,VIVOSSPK17," Tám mươi sáu, tám mươi bảy.",1.0,4.278922080993652,3.063483953475952,0.0
VIVOSSPK20_277,./tiengviet/vivos_data/train/waves/VIVOSSPK20/VIVOSSPK20_277.wav,2.28125,GẶP NHAU ĐÃ KHÓ HUỐNG CHIA XA,VIVOSSPK20, Gặp nhau đã khó hún chia tay,1.0,4.303580284118652,3.354485034942627,0.1428571428571428
VIVOSSPK15_077,./tiengviet/vivos_data/train/waves/VIVOSSPK15/VIVOSSPK15_077.wav,2.875,NHỮNG CUỘC RÚT LUI CHIẾN LƯỢC,VIVOSSPK15, Những cuộc rút lui chiến lược,1.0,3.9747252464294434,3.3271870613098145,0.0
VIVOSSPK08_R009,./tiengviet/vivos_data/train/waves/VIVOSSPK08/VIVOSSPK08_R009.wav,2.4375,VỀ THAM DỰ KHÁ LỚN,VIVOSSPK08, Về tham dự khá lớn,1.0,4.015692710876465,3.2913029193878174,0.0
VIVOSSPK46_035,./tiengviet/vivos_data/train/waves/VIVOSSPK46/VIVOSSPK46_035.wav,3.655625,TRUNG QUỐC BÁC BỎ TIN ĐỒN ĐIỀU CHỈNH TỈ GIÁ NHÂN DÂN TỆ,VIVOSSPK46, Trung Quốc bác bỏ tên đồn điều chỉnh tỷ giá nhân dân tệ,1.0,4.235278606414795,3.100231647491455,0.0
VIVOSSPK22_085,./tiengviet/vivos_data/train/waves/VIVOSSPK22/VIVOSSPK22_085.wav,3.9375,SỚN SÁC TRUY CẢN ẨU ĐỐI PHƯƠNG PHẠM LỖI VÔ DUYÊN,VIVOSSPK22, Sớn sát truy cản ảo đối phương phàm lỗi vô duyên,1.0,4.394620895385742,3.160813570022583,0.0909090909090909
VIVOSSPK15_185,./tiengviet/vivos_data/train/waves/VIVOSSPK15/VIVOSSPK15_185.wav,3.4375,CŨNG CHẲNG CÒN XÚNG XÍNH QUẦN ÁO MỚI,VIVOSSPK15, Cũng chẳng còn súng xính quần áo mới,1.0,4.082677841186523,3.232672929763794,0.0
VIVOSSPK25_026,./tiengviet/vivos_data/train/waves/VIVOSSPK25/VIVOSSPK25_026.wav,8.3125,LẼ ĐƯƠNG NHIÊN CŨNG CÓ THỂ ĐẾN ĐƯỢC VỚI NHAU NHƯNG LIỆU SỰ SẴN SÀNG VỀ MẶT TÂM LÝ CẢ HAI NHƯ THẾ NÀO RỒI,VIVOSSPK25, Lẽ đương nhiên cũng có thể đến được với nhau nhưng liệu sự sẵn sàng về mặt tâm lý cả hai như thế nào rồi?,1.0,4.501299858093262,2.868739604949951,0.0
VIVOSSPK18_174,./tiengviet/vivos_data/train/waves/VIVOSSPK18/VIVOSSPK18_174.wav,1.875,XIN KHẲNG ĐỊNH VỚI CHỊ LÀ,VIVOSSPK18, Xin khẳng định với chị là...,1.0,4.140244960784912,3.1820406913757324,0.0
VIVOSSPK46_095,./tiengviet/vivos_data/train/waves/VIVOSSPK46/VIVOSSPK46_095.wav,4.999375,TRONG MẮT HỌ LÀ CẢ MỘT KHÁT VỌNG ĐƯỢC SỐNG CHUNG VỚI MỌI NGƯỜI,VIVOSSPK46, Trong mắt họ là cả một khát vọng được sống chung với mọi người,1.0,3.97225284576416,3.327169418334961,0.0
VIVOSSPK39_145,./tiengviet/vivos_data/train/waves/VIVOSSPK39/VIVOSSPK39_145.wav,6.4375,CHIẾC VÁY BẰNG LỤA MÀU HỒNG PHẤN VỪA VẶN VỚI THÂN HÌNH MẢNH MAI NHỎ NHẮN CỦA MÌNH KHIẾN CÔ VỪA Ý,VIVOSSPK39, chiếc vé bàn lụa mèo hồng phắn vừa vạn với thân hình mảnh mai nhỏ nhắn của mình khiến câu vừa ấy,1.0,4.409056663513184,2.9473350048065186,0.0
VIVOSSPK35_260,./tiengviet/vivos_data/train/waves/VIVOSSPK35/VIVOSSPK35_260.wav,13.03125,NĂM HỌC VỪA RỒI TÔI THI LẠI VÀI MÔN CHỦ YẾU MẤY MÔN XÃ HỘI HỌC BÀI TRẢ NỢ,VIVOSSPK35," Năm học vừa rồi, tôi thi lại vài môn, chủ yếu mấy môn xã hội học bài trả nợ.",1.0,4.292559623718262,3.048417568206787,0.0
VIVOSSPK15_061,./tiengviet/vivos_data/train/waves/VIVOSSPK15/VIVOSSPK15_061.wav,2.65625,CÁC CHUYÊN GIA Y TẾ,VIVOSSPK15, Các chuyên gia y tế,1.0,3.7412073612213135,3.5274996757507324,0.0
VIVOSSPK12_R185,./tiengviet/vivos_data/train/waves/VIVOSSPK12/VIVOSSPK12_R185.wav,3.4375,MỌI NGƯỜI SẼ CƯ XỬ MỘT CÁCH KỲ QUẶC,VIVOSSPK12, Mọi người sẽ cư xử một cách kỳ hoặc,1.0,4.232829570770264,3.099848508834839,0.0
VIVOSSPK12_R113,./tiengviet/vivos_data/train/waves/VIVOSSPK12/VIVOSSPK12_R113.wav,2.53125,ĐẾN TỪ KHÔNG GIAN XA XÔI,VIVOSSPK12, Đến từ không gian xa xôi,1.0,4.246729373931885,3.0875723361968994,0.0
VIVOSSPK17_012,./tiengviet/vivos_data/train/waves/VIVOSSPK17/VIVOSSPK17_012.wav,3.5625,THẬT TUYỆT VỜI KHI NHỮNG NGƯỜI KHÁC TỎ RA TÔN TRỌNG BẠN,VIVOSSPK17, Thật tuyệt vời khi những người khác tỏ ra tôn trọng bạn.,1.0,4.620404243469238,2.762382984161377,0.0
